,name,album,artist,release date,length,popularity,lyrics
27,Miuzi Weighs A Ton,Yo! Bum Rush The Show,Public Enemy,1987-02-10,344493,0,"

[Intro: Flavor Flav]
Yo Chuck, run a power move on 'em
Yeah, yeah
Yeah, yeah

[Verse 1: Chuck D]
Yeah, step back, get away, give the brother some room
You got to all turn me up when the beat goes boom
Lyric to lyric, line to line
And then you y'all understand my reputation for rhyme
Cause my rhyme reputation depends on what?
Style of record my DJ cuts
His slice and dice, super mix so nice
So bad, you won't dispute the price
Cause it's plain to see, it's a strain to be
Number one in the public eye enemy
Cause I'm wanted in fifty, almost in fifty-one
States where the posse got me on the run
It's a big wonder why I haven't gone under
Dodgin' all types of microphone thunder
A fugitive missin' all types of hell
All this because I talk so well
When I

[Hook]
Rock - get up - get down
Miuzi weighs a ton
Hold it
Rock - get up - get down
Miuzi weighs a ton
Hold it
Rock - get up - get down
Miuzi weighs a ton
Hold it
Rock - get up - get down
Miuzi weighs a ton
Hold it

[Verse 2: Chuck D]
The match up title, the expression of thrill
For elite to compete and attempt to get ill
If looks could kill, I'd chill until
All the public catches on to my material, you know
The ducks criticize my every phase of rapture
Can't wait to read the headlines of my capture
Accused of assault, a first degree crime
Cause I beat competitors with my rhyme
Tongue whipped, pushed, shoved and tripped
Choked from the hold of my kung fu grip
And if you want my title, it would be suicidal
From my end, it would be homicidal
When I do work, you get destroyed
All the paranoid, know to avoid
The Public Enemy seat I've enjoyed
This is no kid and I'm not no toy boy

[Hook]
Rock - get up - get down
Miuzi weighs a ton
Hold it
Rock - get up - get down
Miuzi weighs a ton
Hold it
Rock - get up - get down
Miuzi weighs a ton
Hold it
Rock - get up - get down
Miuzi weighs a ton
Hold it

[Verse 3: Chuck D]
I'm a Public Enemy, but I don't rob banks
I don't shoot bullets and I don't shoot blanks
My style is supreme, number one is my rank
And I got more power than the New York Yanks
If my Uzi wasn't heavy, I would probably fire it
Make you walk the plank if I was a pirate
If they made me a king, I would be a tyrant
If you want to get me, go ahead and try it
Snatcher, dispatcher, biter never been a
Instead of takin' me out, take a girl to dinner
The level of comp has never been thinner
It's a runaway race where I'm the winner
It's unreal, they call the law
And claimed I had started a war
It was war they wanted and war they got
But they wilted in the heat when my Uzi got hot
When I

[Hook]
Rock - get up - get down
Miuzi weighs a ton
Hold it
Rock - get up - get down
Miuzi weighs a ton
Hold it
Rock - get up - get down
Miuzi weighs a ton
Hold it
Rock - get up - get down
Miuzi weighs a ton
Hold it

[Verse 4: Chuck D]
My style versatile said without rhymes
Which is why they're after me and on my back
Lookin' over my shoulder,  seein' what I write
Hearin' what I say, then wonderin' why
Why they can't ever compete on my level
Superstar status is my domain
Understand my rhythm, my pattern of lecture
And then you'll know why I'm on the run
This change of events results in a switch
It's the lateral movement of my vocal pitch
It eliminates pressure on the haunted
But the posse is around so I got to front it
Plus employ tactics so coy
And leave no choice but to destroy
Soloists, groups and what they say
And all that try to cross my way
When I

[Hook]
Rock - get up - get down
Miuzi weighs a ton
Hold it
Rock - get up - get down
Miuzi weighs a ton
Hold it
Rock - get up - get down
Miuzi weighs a ton
Hold it
Rock - get up - get down
Miuzi weighs a ton
Hold it

[Outro]
Yeah, that's right
Public Enemy number one in New York
Public Enemy number one in Philly
Public Enemy number one in DC
Public Enemy number one in Cleveland, Ohio
Also we're Public Enemy number one in St. Louis
Public Enemy number one in New Jersey
And bust it
We're also, Public Enemy number one in Cincinnati
In Atlanta

[Produced by The Bombsquad]

"
28,Throw The 'D',Is What We Are,2 LIVE CREW,1987-01-01,189133,33,"

[Fresh Kid Ice]
Listen up y'all 'cause this is it
Forget that old dance and (Throw that D)

[*Mr. Mixx scratches*]
Let's dance, let- let's- let's dance
Let's- let's dance
Let's dance, let's da- da- dan- dance

[Verse 1: Fresh Kid Ice]
There's a brand new dance and it's coming your way
It was started in Miami by the Ghetto DJs
Say some call it nasty but that's not true
It's just the only dance that you can do
'Cause you need a sexy body, make your partner come alive
If you can't do that, don't even try
So get yourself together and learn it quick
Just get on the floor and (throw that D)

[*Mr. Mixx scratches*]
(Let's dance)

(Throw that D)

[Verse 2: Fresh Kid Ice]
When I went to Miami couldn't believe my eyes
This female was throwing, wanted me to try
If you don't know how to do it here's what you must do
Just listen up close, I'll explain to you
Just jump, in the air
And when you land you wind like you just don't care
It's all in the hips, so go berserk
And let that...do the work
So while it's working you better start stroking
To show your partner that you ain't joking
'Cause this ain't a dance from Mother Goose
Better freak yo body and turn it loose
Cause when you're on the floor you don't give a sh...
All you wanna do is (throw that D)

(Throw that D) etc

( *Mr. Mixx scratches samples from Planet Rock* )

"
29,Remix for P Is Free,Criminal Minded,Boogie Down Productions,1987,258578,21,"

[Intro]
Yes Scott La Rock you know you rule hip-hop
Yes Mr. Lee you can rule hip-hop
357 you can rule hip-hop
But, KRS-One rule it non-stop
When I'm in Brooklyn, yes, me ruling hip-hop
When I'm in Manhattan, me ruling hip-hop
When I'm in Queens, me ruling hip-hop
And when in Staten Island me ruling hip-hop
But in the Bronx, me ruling y'all tonight
But in the Bronx, me ruling y'all tonight
We come to rock you whether you're black or you're white
Cause KRS-One you know I'm never fright
Come catch this, star

[Hook]
The girlies is free cause the crack costs money
Oh yeah!
I say the girlies is free cause the crack costs money
Oh yeah!

[Verse 1]
Riding one day on my freestyle fix
Jamming to a tape Scott La Rock had mixed
I said to myself ""This tape sound funky""
Riding past a 116th Street junkie
Thought I saw Denise but I was only assuming
Took another look and that butt was booming
Did a little trick on my freestyle fix
And I was right beside the girl, she was all on the tip
She said ""Hi, DJ KRS""
She kissed me on my neck so I gave her a peck
She said ""I'm really in a hurry so I cannot wait
If you give me a lift, while we ride we'll debate""
She jumped on my bike, I said ""Huh, what's your stop?""
She said ""Right around the corner to the crack spot
If you buy me a crack I'll know how to act
But if you don't, you might as well step back""
I said ""Now how the hell we jump off to this?
I'm doing you a favor, I'm giving you a lift""
She said ""KRS, you know how it go""
I said ""Yeah, you little... it seems that you're a ho""
I did a little trick on my freestyle fix
And she was right on the ground looking after it
Because...

[Hook]

[Verse 2]
A girl tried to take me out one day
For a play, not your everyday trey
We walked to the spot, she says she want a rock
I looked in my pocket, didn't have a lot
I said... ""You better get yourself a job""
She tried to tell me that times were hard
I told the ho, I said ""Yo, that's not my fault
You need a vault"", I'm out to assault
Any girl I find who try to take me for mine
I'm gonna have to finish this another time
But...

[Hook]

"
30,Boyz-N-The-Hood - Remix,Eazy-Duz-It,Eazy-E,1988-09-13,379733,60,"

[Intro: Dr. Dre, Ice Cube, MC Ren, Eazy-E]
Hey, yo, remember that shit Eazy did a while back?
Motherfuckers said it wasn't gonna work
That crazy shit?
Yeah, the stupid shit, man
That shit was dope
Hey yo, Eazy!
Wassup?
Hey man, why don't you come off the piano for a minute and bust this crazy shit?

[Verse 1]
Woke up quick at about noon
Just thought that I had to be in Compton soon
I gotta get drunk before the day begins
Before my mother starts bitchin' about my friends
About to go and damn near went blind
Young niggas at the pad, throwin' up gang signs
Ran in the house and grabbed my clip
With the MAC-10 on the side of my hip
Bailed outside and pointed my weapon
Just as I thought, the fools kept steppin'
Jumped in the fo', hit the juice on my ride
I got front and back and side to side
Then I let the Alpine play
Bumpin' new shit by N.W.A
It was ""Gangsta Gangsta"" at the top of the list
Then I played my old shit, it went somethin' like this
Cruisin' down the street in my six-fo'
Jockin' the bitches, slappin' the hoes
Went to the park to get the scoop
Knuckleheads out there, cold-shootin' some hoops
A car pulls up, who can it be?
A fresh El Camino rollin', Kilo G
He rolled down his window and he started to say
""It's all about makin' that GTA""

[Hook]
'Cause the boys n' the hood are always hard
You come talkin' that trash, we'll pull your card
Knowin' nothin' in life but to be legit
Don't quote me, boy, 'cause I ain't said shit

Yo, man!
Get the fuck out!
Pump that beat!
Mothafucka, say what?

[Verse 2]
Donald B's in the place to give me the pace
He said my man J.D. is on freebase
The boy J.D. was a friend of mine
'Til I caught him in my car, tryin' to steal my Alpine
Chase him up the street to call a truce
The silly motherfucker pulls out a deuce-deuce
Little did he know I had a loaded 12-gauge
One sucker dead, LA Times front page

[Hook]
'Cause the boys n' the hood are always hard
You come talkin' that trash, we'll pull your card
Knowin' nothin' in life but to be legit
Don't quote me, boy, 'cause I ain't said shit

Yo, Leroy!
Beer drinkin', breath stinkin', sniffin' glue

[Verse 3]
Bored as hell and I wanna get ill
So I went to a spot where my homeboys chill
The fellas out there makin' that dollar
I pulled up in my 6-4 Impala
They greet me with a 40 and I start drinkin'
And from the 8-ball my breath starts stinkin'
Left to get my girl, to rock that body
Before I left I hit the Bacardi
Went to her house to get her out of the pad
Dumb ho said somethin' that made me mad
She said somethin' that I couldn't believe
So I grabbed the stupid bitch by her nappy-ass weave
She started talkin' shit, wouldn't you know?
Reached back like a pimp, slapped the ho
Her father jumped up and he started to shout
So I threw a right cross and knocked his old ass out

[Hook]
'Cause the boys n' the hood are always hard
You come talkin' that trash, we'll pull your card
Knowin' nothin' in life but to be legit
Don't quote me, boy, 'cause I ain't said shit

Who do you think you are, Mr. Big Stuff?
Rock mothafucka, like the hard three the hard way

[Verse 4]
I'm rollin' hard, now I'm under control
Then wrapped the six-fo' round a telephone pole
I looked at my car and I said, ""Oh, brother
I'll throw it in the gutter and go buy another.""
Walkin' home and I see the G ride
Now Cat is drivin' Kilo on the side
As they busted a U, they got pulled over
A undercover cop in a dark green Nova
Cat got beaten for resistin' arrest
He socked the pig in the head for rippin' his Guess
Now G is caught for doin' the crime
Fourth offense on the boy, he'll do some time

[Hook]
'Cause the boys n' the hood are always hard
You come talkin' that trash, we'll pull your card
Knowin' nothin' in life but to be legit
Don't quote me, boy, 'cause I ain't said shit

L.A. playa
Big Drum beater

[Verse 5]
I went to get them out, but there was no bail
The fellas caused a riot in the county jail
Two days later in municipal court
Kilo G on trial cold cut a fart
""Disruption of the court,"" said the judge
On a six-year sentence, my man didn't budge
Bailiff came over to turn him in
Kilo G looked up and gave a grin
He yelled out ""Fire!"", then came Suzy
The bitch came in with a sub-machine Uzi
Police shot the bitch but didn't hurt her
Both upstate for attempted murder

[Hook]
'Cause the boys n' the hood are always hard
You come talkin' that trash, we'll pull your card
Knowin' nothin' in life but to be legit
Don't quote me, boy, 'cause I ain't said shit

Yeah, I kicked a little ass
But that was a blast from the past, mothafucka
Get busy, y'all y'all y'all y'all!

"
31,Children's Story,The Great Adventures Of Slick Rick (Deluxe Edition),Slick Rick,1988-11-01,242040,58,"

[Produced by Slick Rick]

(Now here's a little something that needs to be heard)

[Intro]
Uncle Ricky, could you read us a bedtime story?
Please, huh, please?
All right, you kids get to bed, I'll get the storybook
Y'all tucked in? Yeah
Here we go

[Verse]
Once upon a time not long ago
When people wore pajamas and lived life slow
When laws were stern and justice stood
And people were behavin' like they ought to: good
There lived a little boy who was misled
By another little boy and this is what he said:
""Me and you, tonight we're gonna make some cash
Robbin' old folks and makin' the dash""
They did the job, money came with ease
But one couldn't stop, it's like he had a disease
He robbed another and another and a sister and her brother
Tried to rob a man who was a D.T. undercover
The cop grabbed his arm, he started acting erratic
He said ""Keep still, boy, no need for static""
Punched him in his belly and he gave him a slap
But little did he know the little boy was strapped
The kid pulled out a gun, he said ""Why'd you hit me?""
The barrel was set straight for the cop's kidney
The cop got scared, the kid, he starts to figure
""I'll do years if I pull this trigger""
So he cold dashed and ran around the block
Cop radios in to another lady cop
He ran by a tree, there he saw this sister
Shot for the head, he shot back but he missed her
Looked 'round good and from expectations
So he decided he'd head for the subway stations
But she was coming and he made a left
He was runnin' top speed 'til he was outta breath
Knocked an old man down and swore he killed him (Sorry!)
Then he made his move to an abandoned building
Ran up the stairs up to the top floor
Opened up the door there, guess who he saw? (who?)
Dave, the dope fiend shootin' dope
Who don't know the meaning of water nor soap
He said ""I need bullets, hurry up, run!""
The dope fiend brought back a spanking shotgun
He went outside but there was cops all over
Then he dipped into a car ‒ a stolen Nova
Raced up the block doing 83
Crashed into a tree near university
Escaped alive though the car was battered
Rat-a-tat-tatted and all the cops scattered
Ran out of bullets and he still had static
Grabbed a pregnant lady and pulled out the automatic
Pointed at her head and he said the gun was full o' lead
He told the cops ""Back off or honey here's dead""
Deep in his heart he knew he was wrong
So he let the lady go and he starts to run on
Sirens sounded, he seemed astounded
And before long the little boy got surrounded
He dropped his gun, so went the glory
And this is the way I have to end this story
He was only seventeen, in a madman's dream
The cops shot the kid, I still hear him scream
This ain't funny so don't ya dare laugh
Just another case about the wrong path
Straight and narrow or yo' soul gets cast
Good night

[Outro]
(Knock him out the box, Rick
Knock him out, Rick)
- Oh boy, that Uncle Ricky is really weird
- I know right what does he mean
“Straight and narrow or yo’ soul gets cast""?
- I don’t know, I think he be crackin' it up or something
- Well, good night
- Good night

Another (that's right!) Rick the Ruler presentation
Crumbs!

"
32,Ain't No Half-Steppin',Long Live The Kane,Big Daddy Kane,1988-01-01,319906,50,"

[Intro]
Mmm, mmm, mmm
Aw yeah, I'm with this
I'm just gonna sit here laid back to this nice mellow beat, you know
And drop some smooth lyrics 'cause '88
Time to set it straight, know what I'm sayin'?
And ain't no half-steppin'
Word, I'm ready

[Verse 1]
Rappers steppin' to me, they want to get some
But I'm the Kane, so, yo, you know the outcome
Another victory, they can't get with me
So pick a B.C. date 'cause you are history
I'm the authentic poet to get lyrical
For you to beat me, it's gonna take a miracle
And steppin' to me—yo, that's the wrong move
So what you on, Hobbs—dope or dog food?
Competition, I just devour
Like a pit bull against a Chihuahua
'Cause when it comes to bein' dope, hot damn
I got it good, now let me tell you who I am
The B-I-G D-A-double-D-Y K-A-N-E
Dramatic, Asiatic, not like many
I'm different, so don't compare me to another
'Cause they can't hang, word to the mother
At least not with the principal in this pedigree
So when I roll on you rappers, you better be
Ready to die because you're petty
You're just a butter knife, I'm a machete
That's made by Ginsu, wait until when you
Try to front, so I can chop into
Your body, just because you try to be basin'
Friday the 13th, I'ma play Jason
No type of joke, gag, game, puzzle or riddle
The name is Big Daddy, yes, Big, not little
So define it, here's your walkin' papers, sign it
And take a walk as the Kane start to talk, 'cause ...

[Hook]
Ain't no half-steppin'
I'm the Big Daddy Kane
Ain't no half-steppin'
I'm the Big Daddy Kane
Ain't no half-steppin'
I'm the Big Daddy Kane
""Down the road""

[Verse 2]
My rhymes are so dope and the rappers be hopin'
To sound like me, so soon I'll have to open
A school of emceein', for those who wanna be in
My field and court, then again, on second thought
To have MCs coming out sounding so similar
It's quite confusing for you to remember the
Originator and boy, do I hate a
Perpetrator but I'm much greater
The best, oh, yes, I guess suggest the rest
Should fess, don't mess or test your highness
Unless you just address with best finesse
And bless the paragraphs I manifest
Rap prime minister, some say sinister
Non-stopping the groove until when it's
The climax and IMAX, relax and chill
Have a break from a take of me acting ill
Brain cells are lit, ideas start to hit
Next - the formation of words that fit
At the table I sit, making it legit
And when my pen hits the paper, hah shit!
I stop and stand strong over MCs
And devour with the power of Hercules
Or Samson, but I go further the length
'Cause you could scalp my Cameo and I'll still have strength
And no, that's not a myth and if you try to riff
Or get with the man with the given gift of gab
Your vocab, I'll only ignore
Be sleeping on your rhymes 'til I start to snore
You can't awake me, or even make me
Fear you, son 'cause you can't do me none
So, think about it if you're tryna go
When you wanna step to me, I think you should know that

[Hook]
Ain't no half-steppin'
I'm the Big Daddy Kane
Ain't no half-steppin'
I'm the Big Daddy Kane
Ain't no half-steppin'
I'm the Big Daddy Kane
""Down the road""

[Verse 3]
I appear right here and scare and dare a mere
Musketeer that would dare to compare, put him in the rear
Back there where he can't see clear
Get a beer, idea or near stare, yeah
So on to the wannabe competition
Trying to step to me, must be on a mission
Up on the stage is where I'ma get you at
You think I'm losin'? Pfft, picture that

[Hook]
Ain't no half-steppin'
I'm the Big Daddy Kane
Ain't no half-steppin'
I'm the Big Daddy Kane
Ain't no half-steppin'
I'm the Big Daddy Kane
Mister Cee, step to me

[Verse 4]
The name is Big Daddy, you know, as in your father
So when you hear a def rhyme, believe that I'm the author
I grab the mic and make MCs evaporate
The party people say, 'Damn, that rapper's great'
The creator, conductor of poetry
Et cetera, et cetera, it ain't easy bein' me
I speak clearly so you can understand
Put words together like Letter Man
Now that's dictation proceeding to my innovation
Not like the other MCs that are an imitation
Or an animation, a cartoon to me
But when I'm finished, I'm sure that you are soon to see
Reality, my secret technique
Because I always speak with mentality
I put my title in your face, dare you to base
And if you try and come get it, yo I'ma show you who's with it
So if you know like I know, instead of messing around
Play like Roy Rogers and slow down
Just give yourself a break or someone else will take your title
Namely me because I'm homicidal
That means murder, yes I'm out to hurt a-
-nother MC that try to get with me
I'll just break him and bake him and rake him and take him and mold him and make him
Hold up the peace sign, As Salaam Alaikum!

"
33,You Gots To Chill,Strictly Business,EPMD,1988-06-07,261839,51,"

[Intro: Parrish Smith + sample]
You gots to chill
DJ K La Boss cuts ""Jungle boogie""

[Verse 1: Erick Sermon]
Relax your mind, let your conscience be free
And get down to the sounds of EPMD
Well you should keep quiet while the MC rap
But if you tired, then go take a nap!
Or stay awake and watch the show I take
Because right now - I'm 'bout to shake and bake
The E-R-I-C-K is my name, I spell
Thanks to the clientele, yo I rock well
I'm not an MC who talkin' all that junk
About who can beat who, soundin' like a punk
I just get down and I go for mine
Say ""check one-two"" and run down the line

[Verse 2: Parrish Smith]
To the average MC I'm known as The Terminator
Funky beat maker, new jack exterminator
Destroying a ploy, when your rhymes are not void
Never sweatin' your girl (Why P?) 'Cause she's a skeezoid
When I'm on the scene I always rock the spot
I grab the steel with the crown on top
In the beginnin', I like to let my rhymes flow
And at twelve I press cruise control
Sit back and relax, let my rhymes tax
Maintain MC's while the Double E macks
Always calm under pressure, no need to act ill
Listen when I tell you boy

[Chorus: Parrish Smith]
You gots to chill
DJ K La Boss cuts ""Jungle boogie""

[Verse 3: Erick Sermon]
I be the personal computer information on rap
Like the B-I-Z Markie says, I'll make your toes tap
I format the rhymes, step by step
Make em sound def to maintain my rep
Prepared to come off, in case of a diss
Not worried about a thing, 'cause we can do this
I can turn the party out just by standin' still
Make the ladies scream and shout while the brothers act ill
Take total control of your body and soul
Pack a nine in my pants for when it's time to roll

[Verse 4: Parrish Smith]
I'm the P double-E M-D-E-E
And one thing I hate, is a bitin' MC
When I enter the party suckers always form a line
Then they ease their way up, and try to bite my lines
I did thousands of shows, dissed many faces
And deal with new jacks on a one-to-one basis
But every now and then a sucker MC gets courageous
And like an epidemic it becomes contagious
But never the least they all R.I.P
For all those unaware it means Rest In Peace
'Cause M.D. -- stands for Microphone Doctor
And the capital P (capital P) capital M (capital M)
Capital D-E-E's no doubt the chief rocker
Don't like to get ill, but if I have to I kill
So believe me boy

[Chorus: Parrish Smith]
You gots to chill
DJ K La Boss cuts ""Jungle boogie!""

[Verse 5: Erick Sermon]
Catch every word I'm sayin', no there's no delayin'
Don't hesitate to motivate the crowd I'm not playin'
Seein' is believin', you catch my drift?
Don't try to adapt because I'm just too swift
(How swift?) I'm so swift and that's an actual fact
I'm like Zorro, I mark a E on your back
I don't swing on no ropes or no iron cords
The only weapon is my rappin' sword

[Verse 6: Parrish Smith]
Intimidate MCs with the tone of my vocal throne
When I'm pushin' on the microphone
'Cause I'm the funky rhyme maker, MC undertaker
The one who likes to max and relax
And when it's time, issue dig-em-smacks
I keep their hands clappin', fingers snappin', feet tappin'
When it's time to roll Uzi patrol is packin'
The PMD, the mic's my only friend
And through the course of the party, I kill again and again
So if you're thinkin' bout battlin' you better come prepared
Come with your shield and your armor geared

[Chorus: All]
You gots to chill
DJ K La Boss cuts ""Jungle boogie!""

[Outro: Erick Sermon, Parrish Smith]
DJ La Boss,  takes no shorts

"
