,name,album,artist,release date,length,popularity,lyrics
47,One And One,Move Somethin',2 LIVE CREW,1988-03-21,144373,41,"

(Only Luke performs this track)

* = ""In the bedroom all day and all of the night""

One and one were having some fun *
Two and Two, I took off my shoes *
Three and Three, she undressed me *
Four and Four, we fucked on the floor *
Five and Five, I put up her thighs *
Six and Six, the bitch sucked my dick *
Seven and Seven, we went to heaven *
Eight and Eight, she masturbated *
Nine and Nine, she licked my ass *
Ten and Ten, the bitch did it again *

Get off my ass bitch!

GET YOUR FACE OUT MY ASS MOTHERFUCKER!!

[""Haaa""]
[""But it hurts so good""]
[""Haaa""]

Get laid, get FUCKED!

[""Haaa""]
[""But it hurts so good""]
(repeated 'till the end of the track)

"
48,Eazy-er Said Than Dunn,Eazy-Duz-It,Eazy-E,1988-09-13,219946,49,"

[Intro: Dr. Dre]
Yo' man, I don't think they heard you?
Won't you tell 'em what ya name is?

[Verse 1: Eazy-E]
My name is Eazy, yeah, this is true
Keepin' your attention is what I'm gonna do
Hardcore, yo' I could never be soft
Askin' me my defin' they say the boy goes off
Fillin' up my memo with a touch of my rhyme
Suckers stayin' with me cause they know the time
Quiet on the set because I'm about to begin
And if you didn't hear me boy I'll tell you again
My name is Eazy or just call me E
But It doesn't really matter to me
'Cause I'm the same person
Whether serious or rehearsin'
I just gotta keep cursin'
This is for the radio so I better chill
They won't play it if I cold get ill
But I'm like that and that's an actual fact
Because the street is where my heart is at
Yo' I don't do dope but I'm dope not a dope
But I'm doper than anybody who tries to cope
If the rhyme I'm displayin'
And the beat that's playin'
Yo', you could try all-day
And you still won't match up with the Ruthless P.O.W
Cause Eazy's doin' it Compton style
Thats the city and you say you could get some
Yo', it's easier said than done

[Chorus: Eazy-E]
Woo, woo!

[Verse 2: Eazy-E & MC Ren]
Now it's easy for me to get my point across
So listen up close if ya don't ya might get lost
I'm not a role model or a Dr. Seuss yo I'm a gangsta
And I'm about to get stupid
I guess its time for the trauma
With the E-A-Z-Y-E comma now that's drama
So pay attention by the way I must mention
I'm comin' off hard in the third dimension
With the glare
But you don't need no glasses to stare
It'll probably take you in and it's just like you're there
With the E on the gangsta tip
So if you think I'm a flip or slip don't even trip
Cause I'm a destroyer
My homie Dre is a doctor not a lawyer
Dope MC employer on Ruthless and that's my label
To get the money, the women, and cold bust the fat cables, boy
Master Rhyme's a toy
I mean straight, while you suckin' with the girls enjoy
You must be sick, or you lonely
How you gonna diss me if you don't even know me? (Yo Ren!)
Whassup?
Get the gat show 'em where it's at
And that's just the sound
And next time I'm peelin' your cap
To let you know where I'm comin' from
Eazy said it and it shall be done

[Chorus: Eazy-E]
Woo, woo!

[Verse 3: Eazy-E & MC Ren]
Creating dope jams is a part of the cycle
""Eazy-er Said Than Dunn"", yeah, that's the title
Lovin' the ladies, only the fly ones, ya know?
But what if she's ugly?
Eazy come Eazy go
Don't ask to battle me, homeboy, what's that?
You wanna battle me? Boy, ya better be strapped
'Cause where I'm from it ain't all about that playin'
Now, that's what I'm sayin'
Said before that I was born in '73
Now everybody wants to know the A-G-E
Girls on the tip, fellas too, it seemed
Had everybody thinkin' I was only 15
The fellas would ignore me
The ladies would adore me
And what was I to do?
I wish they’d let the ladies through
'Cause the ladies, I love 'em
Nice, tender and soft
I hate male groupies so just step the hell off
I'm the real Eazy, those others be fakin'
Tryin' to gain fame off the name I'm makin'
Sayin' on your records you could get some
Yo', homeboy, it's easier said than done

[Chorus: Eazy-E]
Woo, woo!

"
49,Sally (That Girl),"So Def, So Fresh, So Stupid",Gucci Crew II,1988,244240,29,"

1, 2, 3
And I woke up early this morning and I went to the 5 and dime
I saw this pretty young lady that was real, real fine
I tapped her on the shoulder and said, ""Mmm, mmm, excuse me, ma'am""
She pulled down her pants and said, ""Splack these hams""

Whoa, oh, oh, oh
Sally ""That Girl""
Whoa, oh, oh, oh
Sally, whew, ""That Girl""

So we walked her to her house, as she opened up the door
It was heart-shaped bed in the middle of the floor
She pushed me on the bed and this you can bet
In between her legs was real, real wet
So I grabbed her by her thighs and I moved up truly
She jumped off the bed and said, ""Don't touch my booty""
""Don't touch my booty 'cause I won't touch you""
""Don't touch my booty 'cause it's not the thing to do""

Whoa, oh, oh, oh
Sally, whew, ""That Girl""
Whoa, oh, oh, oh
Sally, whew, ""That Girl""

So we bailed out her house just to get something to eat
We saw her friend named Patty walkin' down the street
Patty turned around as we yelled out her name
She dropped to her knee and began to sing

Whoa, oh, oh, oh
Sally, whew, ""That Girl""
Whoa, oh, oh, oh
Sally, whew, ""That Girl""

Sally is a girl that likes to play
And if you want some lovin' Sally is okay
She has a different fellow every day of the week
Two or maybe three just to make it sweet
Sally wants a man she can call her own
And sixty-seven hundred she can call on the phone
Sally's never tired and she's never alone
All Sally wants is a fellow with a room

Whoa, oh, oh, oh
Sally, whew, ""That Girl""
Whoa, oh, oh, oh
Sally, whew, ""That Girl""

That-that-that-that-that girl
That-that-that-that-that-that-that girl
That-that-that-that-that-that-that-that-that-that-that-that-that-that girl (Sally)
That-that-that-that-that-that-that girl
That-that-that-that-that-that girl
That-that-that-that-that-that-that-that-that-that-that-that girl-that-that girl (Sally)
That-that girl-that girl-that girl-that girl [Sally] (Sally) [Sally]
That-that-that-that-that-that girl
That-that-that-that-that-that girl
That-that-that-that-that girl (Sally)
That-that-that-that-that girl (Sally)
That-that-that-that-that girl
That-that-that-that-that girl

Wait a second, get the party started
Gucci's here to put the love in your body

That-that-that-that-that girl
That-that-that-that-that girl
That-that-that-that girl (Sally)
That-that-that-that-that girl (Sally)
That-that-that-that-that girl
That-that-that-that girl
That-that girl, that-that girl
That girl (Sally, Sally) [Sally]

"
50,Shake Your Thang (It's Your Thing),A Salt With A Deadly Pepa,Salt-N-Pepa,1988-08-02,241573,39,"

(Ow, shake it!)
Yeah, oh, you're lookin' sweet, baby
Yes, indeedy
Funky (get down)

We was on a dancefloor shakin' our thing
To a funky beat with a go-go swing
Everyone was watching, they stared in shock
Amazed at how Salt and Pepa was rock-
In the place with a smile on my face
Some got upset and then tried to base
They called us nasty, said we danced dirty
Claimed we were freaks, cheap, even flirty
Pepa got pissed and pulled out a pump
I was all set not to jet but to jump
Spin broke it up and asked not to break
Said, ""They don't understand the way you...""

Shake your thang, oww
Do what you wanna do
I can't tell you how to catch a groove
It's your thang (It's your thing)
Do what you wanna do
I won't tell you who to sock it to

Shake that thing, C'mon, y'all, shake it
We could get loose, but we can't get naked
It's not a crime, it's legal, we answered
Look again - see? We're just dancin'
Relax a bit, now ain't that better?
I think it's time for you to get a...
Partner, doe-see, gather in closely
I wanna see the ones that mostly
Front on a cutie, hope you're not fruity
Do your duty and...

Shake your thang, oww
Do what you wanna do
I can't tell you how to catch a groove
It's your thang (It's your thing)
Do what you wanna do
I won't tell you who to sock it to

Come on, y'all, shake that thing
You got to just show no shame
I want you to shake that thing
Come on, y'all, show no shame

Shake your thang, yeah yeah
Oh, you're lookin' sweet, baby
Owww, I won't tell you how to catch a groove

It's my thing, and I'll swing it the way that I feel
With a little seduction and some sex appeal
It's Friday night, and I just got paid
I'm checking out the fella with the high-top fade
Moving in closely, ready for the kill
Steppin' on a dancefloor, think you're ill
But if I guy touch my body I just put him in check
I said, ""We just met"", ""We can't do that yet""
I'm not a pick-up (no), this ain't a stick up (boy)
I'm not stuck up (yeah), and turn to kick up
And just rock, baby-pop, don't stop
Stick out your butt, and shake what you got

Shake your thang, oww
Do what you wanna do
I can't tell you how to catch a groove
It's your thang (It's your thing)
Do what you wanna do
I won't tell you who to sock it to

Ooh, I like hip-hop mixin' with go-go, baby
It's my thing, and I shake it crazy
Don't try and tell me how to party
It's my dance, yup, and it's my body
The shirt I wear may be low cut
My jeans fit nice, it shows off my butt
Designer down from head to toe
Oooo, my hair, neck, and fingers is crazy-glow
Now please stop blushin', we're just dancing, dummy
C'mon, we both know I don't want you for your money
Cuz we like to rap so we always rhyme
I like to dance, ooh, and I like to grind
I like this song, I like this beat
I'll see you later, where shall we...

Shake your thang, oww
Do what you wanna do
I can't tell you how to catch a groove
It's your thang (It's your thing)
Do what you wanna do
I won't tell you who to sock it to

"
51,Set It Off,Long Live The Kane,Big Daddy Kane,1988-01-01,245960,38,"

[Verse 1]
Let it roll, get bold, I just can't hold back
Or fold 'cause I'm a man with soul
In control and effect, so what the heck?
Rock the discotheque and this groove is what's next
Attack, react, exact, the mack'll move you with
A strong song, as long as you groove to this
I keep the crowd loud when you're hype
Do damage onstage and injure the mic
As I shoot the gift, MC's stand stiff
While my rhymes stick to you like Skippy and Jif
Feel my blood fist, or my death kiss
The rap soloist, you don't want none of this
Supreme in this era, I reign with terror
When I grab the mic, believe you're gonna hear a
Fascinatin' rhyme as I enchant 'em
So let's all sing the Big Daddy anthem
Go with the flow, my rhymes grow like an Afro
I entertain again and Kane'll never have no problem
I can sneeze, sniffle and cough
E-e-e-even if I stutter, I'mma still come off
'Cause rappers can't understand the mics I rip
They sure enough ain't equipped, that's why they got flipped
But my apparatus is up to status
Don't ask who's the baddest, of course, that is
The maker, breaker, taker, my rhymes ache the head
Put it to bed, so watch what's said
Save the bass for the pipe and rearrange your tone
Or take a loss and be forced in the danger zone
'Cause I get ill and kill at will
Teachin' a skill that's real, you're no frill
So just stand still and chill as I build
Science I drill until my rhymes fill your head up
Don't even get up
The teacher is teachin', so just shut up

[Chorus x3]
""I can't hold it back""
Set it off

Now break loose

[Verse 2]
Rappers, take a step back, or you will soon regret that
You ever had to confront me and you can bet that
I come correct, perfect, in full effect
Disconnect, dissect, eject as I wreck shop
Stand in command with the clan
Caravan or van, we go man for man and
Without further ado or any delay
Mister Cee as we say, call him the DJ
Mad Money Murf with the triple M
Smooth the barber keepin' my flat-top trim
Scoob Lover my brother, Scrap Lover my other
Dancin' with the crew, so allow the boys to smother
The floor, and endure just for your pleasure
As the microphone lord proceeds to get raw
Acrobatic, Asiatic, rap fanatic
I get dramatic, and rhymes start flowin' automatically from me
So don't play me, obey me
When asked ""Who's the best?"", you better say me
I'm sendin' sucker MC's headin' north
And if you still want some... set if off!
For you to cope is just a wish and a hope
And if you are what you eat, they're feedin' me dope
'Cause I'm just about as dope as dope can get
Ultimate, legit, Kane is a perfect fit
The king of my kingdom, completin' a cipher
The lyrics I bring them keeps the crowd hyper
As I release the masterpiece
The groove will never cease until Kane says ""Peace""
So, maestro, yo, hit it!
Big Daddy Kane's about to come with it, 'cause...

[Chorus x3]
""I can't hold it back""
Set it off

Now break loose

"
52,Rebel Without A Pause,It Takes A Nation Of Millions To Hold Us Back,Public Enemy,1988-06-28,302800,49,"

[Produced by The Bomb Squad]

[Intro: Rev. Jesse Jackson]
""Brothers and sisters! Brothers and sisters, I don't know what this world is coming to!""

[Verse 1: Chuck D]
Yes, the rhythm, the rebel
Without a pause, I'm lowering my level
The hard rhymer -- where you never been, I'm in
You want stylin'? You know it's time again
D, the enemy, tellin' you to hear it
They praised the music, this time they play the lyrics
Some say no to the album, The Show
Bum Rush, the sound -- I made a year ago
I guess you know, you guess I'm just a radical
Not on sabbatical, yes, to make it critical
The only part your body should be partyin' to
Panther power on the hour from the rebel to you

[Ad-lib 1: Flavor Flav]
Ay yo Chuck man, I don't understand this, man!
Yo, you got to slow down man, you losin' them!

[Verse 2: Chuck D]
Radio—suckers never play me
On the mix, they just okay me
Now, known and grown, when they're clocking my zone, it's known
Snaking and taking everything that a brother owns
Hard — my calling card
Recorded and ordered, supporter of Chesimard
Loud and proud, kicking live next, poet supreme
Loop a troop, bazooka, the scheme
(Flavor) A rebel in his own mind
Supporter of my rhyme
Designed to scatter a line of suckers who claim I do crime
They on my time ticket

[Ad-lib 2: Flavor Flav]
Ay yo, Chuck, they think we takin' shorts!
Show 'em this is cold medina, man!
Come on, kick it!

[Chorus]
Terminator X, Terminator X
Terminator X, Terminator

[Ad-libe 3: Flavor Flav]
Yo Chuck, you gettin' em nervous
They can't handle this, they gonna break down!

[Verse 3: Chuck D + Flavor Flav]
From a rebel, it's final on black vinyl
Soul, rock and roll coming like a rhino
Tables turn, suckers burn to learn
They can't disable the power of my label
Def Jam, tells you who I am
The enemy's public, they really give a damn
Strong Island, where I got 'em whylin'
That's the reason they're claiming that I'm violent
Never silent, no dope, getting dumb — nope
Claiming where we get our rhythm from
Number one, we hit ya and we give ya some
No gun, and still never on the run
You wanna be an S1 -- Griff will tell you when
And then you'll come again, you'll know what time it is
Impeach the president, pulling out my ray gun
Zap the next one, I could be your Shogun
(Suckers) don't last a minute
Soft and smooth, I ain't with it
(Hardcore) raw bone like a razor
I'm like a laser, I just won't graze ya
Old enough to raise ya, so this'll faze ya
Get it right boy and maybe I will praise ya
Playing the role, I got soul too
Voice my opinion with volume
(Smooth) Not what I am
(Rough) Cause I'm a man
No matter what the name, we're all the same
Pieces in one big chess game
(Yeah!) The voice of power
Is in the house — go take a shower, boy
P.E. a group, a crew — not singular
We wear black Wranglers
We're rap stranglers, you can't angle us
I know you're listening
I caught you pissin' your pants
You're scared of dissing us
The crowd is missing us
We're on a mission y'all

[Ad-lib 4: Flavor Flav]
Yo Chuck, yo! Yeah, man!
Yo, you got 'em runnin' scared!

[Chorus]
Terminator X, Terminator X
Terminator X, Terminator

[Verse 4]
Attitude, when I'm on fire
Juice on the loose, electric wire
Simple and plain, give me the lane
I'll throw it down your throat like Barkley
You see my car keys, you'll never get these
They belong to the Nine-Eight posse
You want some more, son? You wanna get some?
Bum-rush the door of the store — pick up the album
You know the rhythm, the rhyme plus the beat is designed
So I can enter your mind, boys!
Bring the noise — my time
Step aside for the flex, Terminator X

[Ad-lib 5: Flavor Flav]
Yeah, that's right
This jam is rated cold medina, boy
That's right, cold medina, that's right
We showin' up in E-F-F-E-C-T also known as effect
You understand what I'm sayin'?

[Outro]
Yeah! Yeah, boy!
Bring that beat back
Bring that beat back one more time, Chuck
Y'all wanna hear that beat, right?
Bring that beat back

"
53,Eazy-Duz-It,Eazy-Duz-It,Eazy-E,1988-09-13,259493,55,"

[Intro: Michel'le +  Eazy-E]
He was once a thug from around the way
Eazy, but you should
Bitch shut the fuck up, get the fuck out of here
Yo, Dre (What's up?) give me a funky ass bassline

[Bridge]
What the fuck is up?
In the place to be
Coming on the mic is Eazy-mothafuckin-E
Dre is on the beat, Yella's on the cut
So listen up close while we rip shit up

[Verse 1]
Well I'm Eazy-E, I got bitches galore
You may have a lot of bitches but I got much more
Wit my super duper group coming out the chute
Eazy-E, motherfuckers, cold knocking the boots
'Cause I'm a hip-hop thugster - I used to be a mugster
If you heard (Dopeman), you think I own a drugstore
Getting stupid because I know how
And if a sucker talks shit, I give him a (POW)
8 ball sipping, the bitches are flipping
Slow down, I hit a dip and, continue my tripping
Hitting my switches, collect from my bitches
The money that I make so I can add to my riches
Fill my stash box and start rubbing my gat
Feeling good as hell because my pockets are fat
A hardcore villain cold roaming the streets
And wit a homie like Dre just supplying the beats

[Hook]
Because I'm a gangsta having fun
Never leave the pad without packing a gun
Hitting hard as fuck, I make you ask what was it
Boy, you should have known by now, Eazy-Duz-It

[Bridge]
(""I was"") (""knocking muthafuckas out"")
(""What's your name, boy?"")
(""Funky, fresh Eazy-E"")
(""Kick, kick that shit"")
(""Where you from fool?"") (""Compton"") (""Yeah!"")

[Verse 2]
Rolling through the hood, cold tearing shit up
Stick my head out the window and I say what's up
To the niggas on the corner cold bumping the box
But you know that's an alibi for slanging the rocks
A dice game started so I said what the fuck
So I put my shit in park and had to try my luck
Hard to roll wit my bitch jocking 24-7
Rolled them muthafuckas, ate 'em up, hit 11
Got another point, I made a ten a fo'
Was taking niggas money and was itching for mo'
Laughing in their faces and said you're all making me rich
Till one punk got jealous, cold slap my bitch
He pulled out his gat, I knew he wouldn't last
So I said to myself, homeboy, you better think fast
He shot (gunshots), Then I shot (gunshots)
As you can see, I cold smoked his ass (ha ha)

[Hook]
Because I'm a gangsta having fun
Never leave the pad without packing a gun
Hitting hard as fuck, I make you ask what was it
Boy you should have known by now, Eazy-Duz-It

[Interlude: Dr. Dre + Eazy-E (MC Ren)]
Wait a minute, wait a minute, who does it
Muthafuckin' Eazy does it
(But how does he do it)
""Eazy duz it, do it eazy, that's what I'm doing""
(""Stop!"") (Man, whatcha gonna do now?)

[Verse 3]
Now I'ma break it down just to tell a little story
Straight out the box from the gangsta category
About a sucker, a sucker muthafucka
He's addicted, he's a smoker but in Compton called a clucker
He used to have a house car and golden rings
But the cooky cooky crack took all those things
He must've been starving 'cause he broke in my house
Caught the nigga on the street and straight took his ass out
Now I'm wanted for a murder that I had to commit
Yeah I went to jail but that wasn't shit
Got to the station about a quarter of nine
Call my bitch to get me out 'cause I was down for mine
The bitch was a trip cold hung up the phone
Now my only phone call was in the ganking zone
All the shit I did for her like keeping her rich
I swear when I get out, I'm gonna kill the bitch
Well by now you should know it was just my luck
The bailiff of the station was a neighborhood cluck
I looked him straight in the eye and said what's up
And said let's make a deal, you know I'll do you up
Now back on the streets and my records are clean
I creeped on my bitch wit my Uzi machine
Went to the house and kicked down the do'
Unloaded like hell, cold smoked the ho

[Hook]
Because I'm a gangsta having fun
Never leave the pad without packing a gun
Hitting hard as fuck, I make you ask what was it
Boy, you should have known by now, Eazy-Duz-It

[Outro]
From around the way, born in '73
Harcore B-boy named Eazy-E
It's '88 now, '73's obsolete
A nigga with a serious ass attitude and a hundred percent street
And if you all wanna hear some more...
In one way or the other, I'm a bad brother
Word to the muthafucka

"
54,A Nightmare on My Street,Greatest Hits,DJ Jazzy Jeff & The Fresh Prince,1998,298626,21,"

[Intro: Fresh Prince]
Now I have a story that I'd like to tell
About this guy you all know him, he had me scared as hell!
He comes to me at night after I crawl into bed
He's burnt up like a weenie and his name is Fred!
He wears the same hat and sweater every single day
And even if it's hot outside he wears it anyway!
He's gone when I'm awake but he shows up when I'm sleep
I can't believe that there's a nightmare on my street!

[Verse 1: Fresh Prince]
It was a Saturday evening, if I remember it right
And we had just gotten back off tour last night
So the gang and I thought that it would be groovy
If we summoned up the posse and bum rushed the movies
I got Angie, Jeff got Tina
Ready Rock got some girl I'd never seen in my life
That was all right though 'cause the lady was chill
Then we dipped to the theater set to ill
Buggin', cold havin' a ball
And somethin' ‘bout Elm Street was the movie we saw
The way it started was decent, you know nothing real fancy
About this homeboy named Freddy and this girl named Nancy
But word when it was over I said, “Yo, that was def!”
And everything seemed alright when we left
But when I got home and laid down to sleep
That began the nightmare, but on my street!

[Verse 2: Fresh Prince & Freddy Kruger]
It was burning in my room like an oven
My bed soaked with sweat, man, I was buggin'
I checked the clock and it stopped at 12:30
It had melted, it was so darn hot, and I was thirsty
I went downstairs to grab some juice or a Coke
Flipped the TV off, and then I almost choked
When I heard this awful voice comin' from behind
It said, ""You turned off David Letterman, now you must die!""
Man, I ain't even wait to see who it was
Broke outside in my drawers and screamed, ""So long, cuz!""
Got halfway up the block I calmed down and stopped screamin'
Then thought, ""Oh, I get it, I must be dreamin""
I strolled back home with a grin on my grill
I figured since this is a dream I might as well get ill
I walked in the house, the Big Bad Fresh Prince
But Freddy killed all that noise real quick
He grabbed me by my neck and said
""Here's what we'll do, we got a lot of work here, me and you
The souls of your friends you and I will claim
You've got the body, and I've got the brain""
I said, ""Yo Fred, I think you've got me all wrong
I ain't partners with nobody with nails that long!
Look, I'll be honest, man, this team won't work
The girls won't be on you, Fred your face is all burnt!""
I pat him on the shoulder said, ""Thanks for stopping by.""
Then I opened up the door and said, ""Take care guy!""
He got mad, drew back his arm, and slashed my shirt
I laughed at first, then thought, ""Hold up, that hurt!""
It wasn't a dream, man, this guy was for real
I said, ""Freddy, uh, pal, there's been an awful mistake here.""
No further words and then I darted upstairs
Crashed through my door then jumped on my bed
Pulled the covers up over my head
And said, ""Oh please do somethin' with Fred!""
He jumped on my bed, ripped through the covers with his claws
Tried to get me, but my alarm went off
And then silence! It was a whole new day
I thought, ""Huh, I wasn't scared of him anyway.""
Until I noticed those rips in my sheets
And that was proof that there had been a nightmare, on my street

[Outro: Fresh Prince, Jazzy Jeff & Freddy Krueger]
Oh man, I gotta call Jeff, I gotta call Jeff
Come on, come on
Come on Jeff, answer
Come on, man
Hello?
Jeff, this is Prince, man
Jeff, wake up
Jeff, wake up
What do you want?
Jeff, wake up, man
Listen to me, Jeff
It's three o'clock in the mornin', what do you want?
Jeff, Jeff, would you listen to me?
Listen, whatever you do, don't fall asleep
Man!
Jeff, listen to me, don't go to sleep, Jeff
Look, look, I'll talk to you tomorrow, I'm going to bed
RRAHHHH!
Ahhhhhh!
Jeff! Jeff!
Ha, ha, ha, ha, ha, haaaa!
Ahhhhhh!
Jeff!
RRAHHHH!
Jeff! Answer me, Jeff!
I'm your D.J. now, Princey!
Ahh, ha, ha, ha, ha, ha, ha, haaaaa!

"
