,name,album,artist,release date,length,popularity,lyrics
70,Droppin' Em,Walking With A Panther,LL Cool J,1989-06-09,262800,25,"

[LL Cool J]
Just like Paul Lynde, you're all in...

Brace yourself, I'm the ace with grace
I'm a win the race and make you feel disgrace
In any case, yo, I'm movin like a steeplechase
MC soldiers: about face
Now step off, I need room for my takeoff
My custom made lyrics slay, yours are soft
I think you better tape this, yo, you can't escape this
Yo, I planned it out just like a landscapist
Whipper-snapper back up for comin' crap up
I plan to trap a MC and kidnap a phony
So skip the baloney
You and your cronies need to jump on a pony
And roll, cause you're just a rookie
When it was time for rap school, you must have played hooky
I'm the show-stopper, your rhymes are improper
I'ma teach you like the master taught the grasshopper
Just gettin warmer, I'm a transform a
Regular rhyme into a barnstormer
Try to jump, I'll pump you, chump, my job is thorough
Any MC, state, city or borough will get ragged
I drop like a sandbag
Serious as the mob, I don't play tag
Best of the batch, no man can catch up
Holes can't be patched, our battle's a mismatch
I flip lyrics like a acrobat
And avoid combat like a diplomat
But when it's time for back-crack, or Jack to kill
It's a thrill to drill, a run-of-the-mill bill
With my skill, I'm the lord of rhymes
And I be writing at a rapid pace way past my bedtime
I rock the mic unlike some brothers I know
I guess they flow, PSYCH!

[Hook]
I'm droppin 'em
Droppin 'em

Yo, you're all in, stiff as a mannequin
I'm sharp as a pin, and I'ma teach discipline
I get busy like it's two of me
Evidently, I'm hated by a few MCs
But so what? I just max like I'm playing the sax
And take the crowd to the climax
Yo, Cool J, I never go astray
I'm funky, you can hear me at the Milky Way
You're weak, wet grass, I'm cool as jazz
Got razamatazz, ask my man Shabazz
I know you're afraid because I'm self-made
I invade, and blow up like a hand grenade
MCs are terrorstruck, I'ma run amok
Cause your rhymes suck, you made a record on potluck
Just a toyboy, can't stop my convoy
Rhymes I said last year were just decoys
I'm like a fox, you annoy me like chicken pox
I'm back with a style that's unorthodox
You must've had a teaspoon full of bull
I'm like The Hulk, with more bulk, I'm powerful
They try to get with this, to me that's an insult
Boys shouldn't mess with an adult, that's too difficult
I enter like a giant saying ""fee fi foe fum""
Then rock the auditorium until there's pandemonium

[Hook]
I'm droppin 'em
Droppin 'em

Don't sleep, cause I'ma go deeper
All you sleepers, I'm the Grim Reaper
My rhymes are rising, the angle's getting steeper
I hated Mussolini, Martini so I'ma sweep a
Emcee, like he's one of the two
Break him into fragments right in front of you
Mic check, one, two, is too fundamental
My rhymes are monumental over an instrumental
In the center, I had to enter
Tormentor mentor experimenter and inventor
Of lyrics, so all you nonbelievers
It'll echo in your dreams at night when you receive a
Rude awakening, you can't do anything
You enter my kingdom and you cry as men bring
Gifts to the prince of excellence and magnificence
Alarm clock rings, you wake up, and you're convinced
That the crew invader, soloist exterminator
Greater evader of ducks, concert crusader
Is bad, my nickname's the circuit breaker
Eating up the world, acre by acre

[Hook]
I'm droppin 'em, word to motha
Droppin 'em

KnowhatI'msayin? Straight 'til 1999, droppin' 'em!
Yo, year 2000, yaknahmsayin?
Audi man
Yo, I'm droppin' 'em

"
71,Just a Friend,Just a Friend - EP,Biz Markie,2009-06-11,238266,59,"

[Verse 1]
Have you ever met a girl that you tried to date
But a year to make love she wanted you to wait?
Let me tell a story of my situation
I was talkin' to this girl from the U.S. nation
The way that I met her was on tour, at a concert
She had long hair and a short miniskirt
I just got on stage, drippin', pourin' with sweat
I was walkin' through the crowd and guess who I met
I whispered in her ear, ""Come to the picture booth
So I can ask you some questions to see if ya hundred proof""
I asked her her name, she said: ""Blah-blah-blah""
She had 9/10 pants and a very big bra
I took a couple of flicks and she was enthused
I said: ""How do you like the show?"" She said: ""I was very amused""
I started throwin' bass, she started throwin' back mid-range
But when I sprung the question, she acted kind of strange
Then when I asked, ""Do ya have a man?"", she tried to pretend
She said: ""No, I don't, I only have a friend""
Come on!
I'm not even goin' for it, this is what I'm goin' sing

[Chorus]
You, you got what I need
But you say he's just a friend
And you say he's just a friend, oh baby
You got what I need
But you say he's just a friend
But you say he's just a friend, oh baby
You got what I need
But you say he's just a friend
But you say he's just a friend

[Verse 2]
So I took blah-blah's word for it at this time
I thought just havin' a friend couldn't be no crime
'Cause I have friends and that's a fact
Like Agnes, Agatha, Germaine, and Jack
Forget about that, let's go into the story
About a girl named ""blah-blah-blah"" that adored me
So we started talkin', gettin' familiar
Spendin' a lot of time, so we can build a
Relationship or some understanding
How it's gonna be in the future we was plannin'
Everything sounded so dandy and sweet
I had no idea I was in for a treat
After this was established, everything was cool
The tour was over and she went back to school
I called every day to see how she was doin'
Every time that I called her, it seemed somethin' was brewin'
I called her room, a guy picked up, but then I called again
I say: ""Yo, who was that?"" ""Oh, he's just a friend""
Don't gimme that, don't even gimme that!
Jus' bust this

[Chorus]
You, you got what I need
But you say he's just a friend
And you say he's just a friend, oh baby
You got what I need
But you say he's just a friend
But you say he's just a friend, oh baby
You got what I need
But you say he's just a friend
But you say he's just a friend

[Verse 3]
So, I came to her college on a surprise visit
To see my girl, that was so exquisite
It was a school day, I knew she was there
The first semester of the school year
I went to a gate to ask where was her dorm
This guy made me fill out a visitor's form
He told me where it was and I was on my way
To see my baby doll, I was happy to say
I arrived in front of the dormitory
""Yo, could you tell me where is door three?""
They showed me where it was for the moment
I didn't know I was in for such an event
So, I came to her room and opened the door
Oh, snap! Guess what I saw?
A fella tongue-kissin' my girl in her mouth
I was so in shock, my heart went down south
So please, listen to the message that I send
Don't ever talk to a girl who says she just has a friend...

"
72,Smooth Operator,It's A Big Daddy Thing,Big Daddy Kane,1989,284466,49,"

[Verse 1]
Well excuse me, take a few minutes, to mellow out
Big Daddy Kane is on the mic and I'mma tell about
A minimum length, of rhymes of strength
And power, so listen to the man of the hour
Flow and go to a slow tempo and you know
Sing ho, swing low, then yo the show
Will go on, as I perform
Transformin' on stage like a Decepticon
But I'm not animated like a cartoon
I'm for real, shootin' lyrics like a harpoon
Across the crowd, the listeners, the spectators
So let's groove with the smooth operator

[Hook]
""Cause I'm so smooth...""

The B-I-G, D-A-double-D-Y-K-A-N-E
I'm good and plenty, servin' many and any
Competition, wishin' for an expedition
I'm straight up dissin' and dismissin', listen
Rappers act so wild, and love to profile
Frontin' hard but they ain't got no style
I give nightmares to those who compete
Freddy Krueger, walkin' on Kane Street
Confuse and lose abuse and bruise the crews
Who choose to use my name wrong, they pay dues
Destruction from the exterminator
But in a calm manner, cause I'm a smooth operator

[Hook]
""Cause I'm so smooth...""

[Verse 2]
Now girls step up to this
One simple kiss, and it's over, miss
Sold to nice dreamers, high as the price seem
Girlfriend, you been scooped like ice cream
So just swing or fling a gathering, try to cling
Cause It's a Big Daddy Thing
And I'm lovin' 'em right, word is bond
So just play Marvin Gaye and Let's Get It On
I make it real good like Dr. Feelgood
To make sure that my point is understood
That when it comes to this there's none greater
Sincerely yours... the smooth operator

[Hook]
""Cause I'm so smooth...""

[Verse 3]
Now ain't that the pot callin' the kettle black
Sayin' I'm a new jack, you need to be smacked
The smooth way I say 'em and the way I display 'em
To make them sound different in a way that's gifted
And hey I'm, makin sure every lyric is done fine
And I make one line, bright as the sunshine
Attack you like Robitussin on a cough
If you know like I know -- step off
Competition, I'mma get rid of
You can't get a bit of, so just consider
A break or rest, vacation, hibernation
And make way for my smooth operation
I'm a smooth operator

[Hook]
""Cause I'm so smooth...""

Ahhhhh yeahhh, and you don't stop
Genuine for '89
And I still ain't half-steppin, peace!

"
73,Wrath of My Madness,All Hail the Queen,Queen Latifah,1989-11-07,257000,27,"

[Verse 1]
My mellow, Latee, was kicking flavor
The R.E. posse said ""Yo Latifah we can do this""
So I paused and took a thought
Then my brillance I caught
And I agreed because I already knew this
Now you should want to flex
Cause I'm in full effect
Queen Latifah is five-oh on this set
You've been begging and dying
For somebody's rhyming to set you free
For God so loved the world he gave you me
I'm coolin', teaching those needing schoolin'
And the mic? This mic in my hand? I'm rulin'!
So prepare your mind for my lifeline
And meet the new Queen of Royal Badness
Latifah has the spirit so head for the water
And dive into the wrath of my madness

[Chorus]
Cost of living getting higher
Cause them to run away
Queen Latifah getting higher
Cause them to run away

[Verse 2]
Some MCs act bold and arrogant
Vain and using each other to compete with
These subjects I pity
Cause their rhymes are not witty like mine
To write a rhyme that's so delicious you can eat it
There are those who like my taste
But don't consider biting
There's penalties for those who don't do right
And just be reciting
Everyone else's word that took a lot of thinking
It's not our fault your thoughts are shrinking
Well, mine are growing
Yes you know like all the woman inside of me
Despite what you do or say
And even in spite of me
Brothers, catch my eye with little hijinks like eye winks
Dying to have a lover of my likeness
So release all your shyness
Just call me ""Your highness""
And dare to feel the wrath of my madness

[Chorus]
Cost of living getting higher
Cause them to run away
Queen Latifah getting higher
Cause them to run away

[Verse 3]
Word of mouth is always everlasting
And everlasting are the words that I bring
The ruler of the ring is Lord Ramsey
And music is made by Mark the 45 King
You tremble for my treble
You're begging for the bass
The voice is too vicious
The same as the pace
The crowds, they love me
The brothers give only hugs
Their shrink-to-fit button-flies fit quite snug
As a bug, you know why? Because I'm bugging
Off the beats that DJ Mark is loving
So plex off the sounds that I'm pumping
I'm jumping with energy to turn your mind to gladness
Come on, just get into it
Don't lie and say you've been through it
Feel the wrath of my madness

[Chorus]
Cost of living getting higher
Cause them to run away
Queen Latifah getting higher
Cause them to run away

[Verse 4]
The scene is mine cause I took it
I took it for the money and I took it for the fun
Don't step up in my face
You don't want to feel the taste
Don't try to play me out
Cause I am not the one
Brothers on my bra strap
Sisters clocking my sound, why?
Because they wanna be down with the
Queen L-A-T-I-F-A-H in command
I supply the concept for you to understand
For those who want to bite
Don't make me have to fuss
The only thing you get is the gluteus maximus
Suckers on the tip
You're loving me, you're leaving me
You wish that one day you could have this
Come on, you know the time
Just be thankful for the rhyme
And get up on the wrath of my madness

"
74,CussWords,Life Is...Too $hort,Too $hort,1989-01-31,465200,37,"

So you motherfuckers thought I was gonna change my style?
- So what are you saying Todd?

To all you bitches, hoes, and all that shit
Here's another rap that I'm ready to spit
It goes like this, my name is $hort
I'm tearing shit up like never before
Pimp slaps, making snaps
Cold cash money and Too $hort raps
Oakland, California that's where I'm from
The city where the boys say you don't want none
But if you do, I'm gonna tell you this
Trues and Vogues ain't really shit
Wanna roll so hard, all of the time
You and that bitch playing Too $hort rhymes
If you ask me what it's all about, I'll say it's about that money
But if you ask me could you have some, I'll say it doesn't concern me
Ronald Reagan came up to me and said, ""Do you have the answer
To the U.S. economy and a cure for cancer?""
I said, ""What are you doing in the White House if you're not selling cocaine?
Ask your wife, Nancy Reagan, I know she'll spit that game
Like one night, she came to my house, and gave me a blow job
She licked my dick, up and down, like it was corn on the cob""
What is life? Life is Too $hort
I play young bitches like it's a sport
Yeah, I play the bitches just like y'all
Like Dr. J played basketball
You can call me Too, don't say it twice
You'll get me real mad and I'll fuck your wife
You see I'm not proper, I'm rarely polite
Too $hort, Too $hort, don't say it tonight, biatch
It started on a bright morning in 1987
I was in my drop-top Caddy y'all
Getting sucked by a bitch named Helen
Nasty bitches, around the world, I wrote this rhyme for you
You might not like my rap, but I'm telling you bitch it's true
So much death in the Oakland streets
Am I gonna live till next week?
Will I get shot by a dope fiend
Trying to get high, trying to steal my ring?
I really can't say, 'cause I don't know why
People out here dropping dead like flies
I used to see a home boy, give him five
Now I say, ""Man, you still alive?""
Cold as hell, this town I'm from
Won't last too long when you're faking the funk
I'm the master rapper, so unique
Clap my hand when I want my freak
You can't deny it, you know I'm right
I turn any rapper out when I'm on the mic
And I won't kick back, or relax
Till he knows I'm the best at the MC rap
Till he knows Too Short, set the trap
That got him caught up in my serious cap
Motherfucker can't spit straight game on the mic
'Cause he's worse than a fag or a Frisco dyke
He's a sucker MC, I call him punk
Trying to spit that rap, you can scratch that junk
You little punk-ass boy, wouldn't listen to me
Think I'm faking but I'm taking all you sucker MC's
To the end of the world and push you over
Good luck couldn't find you in a four leaf clover
If I ever said a rap trying to cap on you
I wouldn't even sweat it 'cause you'll be through
Looking so far up, you might fall down
Getting clowned by the hound from east Oaktown
And the look in your face when you're looking at Too
Could make a grown man die, laughin' at you
'Cause you're a no rappin', no rhymin'
Played out fake ass Simple Simon
I never understood one word you said
But you're swearing up and down that you're killing me dead
There's only one thing, I wanted to know
Sucker motherfucker, where's the joke?
I'm the player of players, just call me Pop
My name is Too $hort, no I don't stop
I just don't stop mackin', don't stop cappin'
Don't stop rappin', now you see what happens
Your mind is gone, your crew just cut
Sucker MC I'll tell you what
Your rhymes are weak, your rap the same
And when it comes to game, you are lame
Never even heard of Too $hort baby
Hit Oakland in 1980
Singing more raps than a rap could rhyme
Telling sucker MC's don't waste my time
There's a girl I know her name is Betty
Straight to the head just rock it steady
She's so freaky she'll juice you up
All the home boys just can't get enough
She's a Ph.D., don't even stop
In the back like that going chop chop chop
I won't say white girl, won't say she's black
She's the kind of girl that make your knees go crack
Feel the beat, rock with me
Let me tell you what I be
I'm a MC rapper, a MC rapper
A big bank roller and a cold, cold capper
Hey baby, I got this rhyme
It's not gonna stop till the end of time
Like rock and roll I'll play that song
To the beat all day and all night long
So listen up, to what I'm saying
I'm a Oaktown mack, bitch I ain't playing
To all the home boys doing time in the pen
Gonna rock this beat for you once again
If you can't get out and you're mad as hell
Say beeatch, now make it sound for real
I'mma tear shit up if I get the chance
I could give a fuck less if your ho don't dance
See I'm a big mack now, I'm so great
I was born and raised in the Golden State
Call me T.O.O.; if you say $hort
I'mma rap my ass off till you give me some more
Big bank, now just make me rich
Bitch bitch bitch bitch make me rich
Check out my style, baby I don't quit
I heard this freak say, ""That's the shit
He took the cake, fucked the rake
Too $hort baby damn sure ain't fake.""
But the sucker MC's are screaming loud
Saying Sir Too $hort, shut your mouth
How can you talk about me, and call me weak
When your father smokes coke and your mother's a freak
So I keep on rappin' if nothing else
Keep your jealous ass thoughts to yourself
[Bitch] Picture this, he's a MC right
[Bitch] Ain't saying nothing but he's holding the mic
[Bitch] Fuck with me, and boy you're doomed
I'll send a trick with a ho to the motel room
'Cause I'm the coldest MC on a microphone
Like a .357 pointed at your dome
I got cap for cap, you never heard
So fresh again with cusswords
Motherfucking shit, fucking with me
Fuck a skank bitch and a sucker MC
All you bastards got the claps
And fuck you punk 'cause you still can’t rap
Cusswords, just let em roll
Motherfucking shit, God damn asshole
Cusswords, just don't quit
Motherfuck you damn shithead bitch
It's Too $hort, on the mic, and it don't stop
And it don't stop, and it won't stop, beeatch
Check out my style

"
75,Know How,Stone Cold Rhymin' (Deluxe Edition),Young MC,1989-01-01,242880,50,"

[Verse 1]
Some of the busiest rhymes ever made by man
Are goin' into this mic, written by this hand
Are comin' out of this mouth, made by this tongue
I'll tell you now my name, my name is Young
But do you think that it's your destiny
To get the best of me, but I suggest to be
Quiet, bro', don't even try it from the east and west of me
Takin' it and never breakin' it or even shakin' it
Groovin' it and always movin' it, cuz I'm not fakin' it
Pullin' out rhymes like books off the shelf
Born in England, raised in Hollis, taught to go for myself
This is stone cold rhymin', no frills, no fluffs
And it's no accident that these rhymes sound tough
I'm goin' off, baby, there's no turnin' back
I'm on your TV, on your album, cassette, and 8-track
And when the show is finally finished I'll be takin' my bow
My name is Young, and yo I got know-how, you know what I'm sayin'?

I got know-how
Party people
I got know...how
I kick it just like this...

[Verse 2]
I got juice like the president, I'm makin' rappers hesitant
Invite me to your house and I'll be chillin' like a resident
Yes, cuz I'm that type of man
Cuz I make myself at home no matter where I am
I got it rollin' like thunder, makin' Y'all wonder
Why I'm on top with all the other rappers under
I make no errors, mistakes or blunders
It's like a wedding, let no man put asunder
My name is Young MC, I like to rock mic well
Cuz when I get up on the mic I just release my spell
It's no hocus-pocus, I'll just get you into focus
And swarm all over you just like a horde of locusts
Smooth operator, female persuader
Spot a fly girl and in a week I'm gonna date her
I got the kind of style for the here and the now
And I can do it cuz I got know-how, you know what I'm sayin'?

I got know-how
Party people
I got know...how
Bust it!

[Verse 3]
MC's I'll ruin, cuz I know what I'm doin'
I'll treat 'em like Doublemint gum and start chewin'
I spit 'em out when the flavor's gone
And I repeat the chewin' practice 'til the break of dawn
Cuz I'm tough like a bone, sly like Stallone
Rockin' and clockin' on the microphone
Smooth like a mirror, in hearts I strike terror
Rhymes like runs and hits with no errors
Cold like a blizzard, on the mic I am the wizard
With the funky fresh rhymes comin' out of my gizzard
Never sneezin', never coughin', I rock the mic often
Hard as a rock and no sign I'll soften
Makin' sure I get respect, on my mind rhymes connect
I start to build like a builder from an architect
Movin' all around, above and under the ground
You see my face, and then you hear my sound
Comin' atcha with the mic in hand
I'm gonna take command just the way I planned
Cuz I'm a one-man band and you are my fan
Don't you understand? I'm like Superman
Yeah, the Man of Steel, don't you know the deal?
You better be for real, I got sex appeal
This is what I feel, and this here's my vow
And now you know the brother with know-how, you know what I'm sayin'?

I got know-how...
And I'm chillin'
Never illin'
In my mouth, I got two fillins...
Whatever!
I'm on the mic, cold stone gettin' over
My name is Young MC, known as the fly casanova, kick it...

"
76,Steppin' To The A.M.,The Cactus Album (Expanded Edition),3rd Bass,1989-11-14,290466,17,"

*sound of clocks ringing*

[Verse One: MC Serch]
Ready in the intro, cue up the Serch-lite
Point us to the center stage (I'll grab the first mic)
Projectin the voice with this mic that I'm cuffin
You ain't my nucka, SUCKER I'm snuffin
The word of the 3rd stands true, so no panickin
(Man verse man) you freeze up like a mannequin
Petrol, you let go, the wax for the new jacks
To dwell upon you're steppin on the trigger as the tune smacks
(Square in the butt) Pete gave me the cue
So I'mma put up or shut up until my jam is through
But for now I wanna freak em, so I'll embark
To spark your mission posse, til way past dark
(Don't park there's no standin) or I'll play the five-oh
You don't stop movin until the Serch says so
To keep the tribe open, shootin out to play em
Three the hard way'll keep you steppin' to the A.M

[Beastie Boys samples playing]
(At the sound of the tone, the time will be 1 A.M.)

[Verse Two: Pete Nice]
My mind has a question, I respond
To a silver domed microphone (one step beyond)
Straight to eighty-eight to the curves of the 90's
I'm universal, I set a line free
Behind me, the three the hard way, the jackpot
(Awaitin Satan's, tryin to take cheap shots)
We groove crowds, the three stand proud
The brothers round the way sit down and say
(How'd you do this?) Ludicrous rhythm of rhyme
Anticipate like a bottle of Heinz.. KETCHUP
(No catch up!) Cause you fell behind
I'm steppin to the A.M. -- dickin down swine
Pete Nice skims over lyrics, I pick em
Strong and long, you're wrong, I stick em
(He's the law with the sword) with my cable swingin
(Like _The Pit or the Pendulum_) Pete Nice bringin
The sunrise with no lies, legitimate (and you despise)
Envy this MC's magnitude (so realize)
The MC emceed (The DJ deejayed em)
Until the next time I keep you steppin' to the A.M

[Sample]

[Verse Three: MC Serch]
No weight on the felt plate, deep bass below rise
Needle torture groove, move the record til the wack stride
(Schoolin the swine on the strength of my vocab)
Bet you wonder you're a goner
(You're thinkin that you had)
Lyrics to the A.M. but the house needs a swinger
You st-st-st-st-stutter, but I'm a stinger
(My rhymes so potent, I wrote em and it's evident)
You're just a stunt, seekin a settlement
The lyrical line (The article original)
Afflict like a convict, I ain't no criminal
Schemin on a cable or slobbin the knob
You played me like a foul ball
(How you livin Hobbes?!?!!)
Now groove into the A.M., the master spoon feedin
Out a jumper, you're bumpin a freak while I'm G'n
Peter let the record spin (Serch'll get a second wind)
MOTIVATE THE CROWD, til it's steppin' to the A.M

[Sample]

[Verse Four: Pete Nice]
I slide swiftly, keep a brother steppin
(loungin, strength in my throat)
Sweatin as you get hit with the rhythm
My lines sustain like a crane, so uplift them
(slow and smooth) Flowin like fluid
The mass did worship the lyrics the three did
(amid all crisis) Drop it like a guillotine
(You're moist) fearing the voice of the rhyme fiend
Scene is zipped, Pete Nice is your worst dream
Fulfilled your illed I thrilled (I heard a LOUD scream)
My mind is cued, so I run down a menu
That downgrades the weak as my lyrics tend to
(the needs of a shaker, sweatin to the point of exhaust)
So listen to the mission horse
Blinded by the science, my mind starts flexin
Sexin down females to the A.M., perplexin
A complex reflex (you wonder if we slumber)
The three don't sleep (Aiyyo Pete Nice take em under!)
Steppin to the A.M., I'm steppin to the mic
To snatch up and smash up the club until daylight!

"
