,name,album,artist,release date,length,popularity,lyrics
272,Disco 2000,Different Class,Pulp,1995-10-30,273573,64,"

[Verse 1]
Oh, we were born within one hour of each other
Our mothers said we could be sister and brother
Your name is Deborah, Deborah
It never suited ya
And they said that when we grew up
We'd get married and never split up
Oh, we never did it
Although I often thought of it

[Pre-Chorus]
Oh, Deborah, do you recall?
Your house was very small
With woodchip on the wall
When I came round to call
You didn't notice me at all
And I said

[Chorus]
Let's all meet up in the year 2000
Won't it be strange when we're all fully grown?
Be there 2 o'clock by the fountain down the road
I never knew that you'd get married
I would be living down here on my own
On that damp and lonely Thursday years ago

[Verse 2]
You were the first girl at school to get breasts
And Martyn said that you were the best
Oh, the boys all loved you but I was a mess
I had to watch them try and get you undressed
We were friends, that was as far as it went
I used to walk you home sometimes, but it meant
Oh, it meant nothing to you
'Cos you were so popular

[Pre-Chorus]
Deborah, do you recall?
Your house was very small
With woodchip on the wall
When I came around to call
You didn't notice me at all
And I said

[Chorus]
Let's all meet up in the year 2000
Won't it be strange when we're all fully grown?
Be there 2 o'clock by the fountain down the road
I never knew that you'd get married
I would be living down here on my own
On that damp and lonely Thursday years ago

[Bridge]
Do it
Oh yeah
Oh yeah

[Pre-Chorus]
Oh, Deborah, do you recall?
Your house was very small
With woodchip on the wall
And when I came around to call
You didn't notice me at all
And I said

[Chorus]
Let's all meet up in the year 2000
Won't it be strange when we're all fully grown?
Be there 2 o'clock by the fountain down the road
I never knew that you'd get married
I would be living down here on my own
On that damp and lonely Thursday years ago

[Outro]
Oh, what are you doing Sunday, baby?
Would you like to come and meet me maybe?
You can even bring your baby
Ooh, ooh-ooh-ooh, ooh, ooh, ooh
What are you doing Sunday, baby?
Would you like to come and meet me maybe?
You can even bring your baby
Ooh, ooh-ooh-ooh, ooh, ooh, ooh
Ooh-ooh-ooh, ooh, ooh, ooh

"
273,Time Bomb,...And Out Come The Wolves,Rancid,1995-08-15,144333,62,"

[Verse 1]
If you wanna make a move then you better come in
It's just the ability to reason that wears so thin
Livin' and dyin' and the stories that are true
Secrets to a good life's knowing when you're through

[Chorus]
Black coat, white shoes, black hat, Cadillac
Yeah! The boy's a time bomb
Black coat, white shoes, black hat, Cadillac
Yeah! The boy's a time bomb

[Verse 2]
Well, he's back in the hole where they got him living
Like a rat but he's smarter than that nine lives
Like a cat fifteen years old take him to the youth authority home
First thing you learn you gotta make it in this world alone

[Chorus]
Black coat, white shoes, black hat, Cadillac
Yeah! The boy's a time bomb
Black coat, white shoes, black hat, Cadillac
Yeah! The boy's a time bomb

[Verse 3]
Now he's gotten out, he gotten free, he gotta go, gotta car
He's twenty-one years old, he's runnin' numbers from the bar
His pager's beepin', he's got in deep in
Whatever he can move on in you know that kid's a creepin'

[Chorus]
Black coat, white shoes, black hat, Cadillac
Yeah! The boy's a time bomb
Black coat, white shoes, black hat, Cadillac
The boy's a time bomb
(Yeah) The boy's a time bomb

Tears come from the razor that's been tattooed below his eye
His mother cries, she knows that he is strong enough to die
He's rollin' in the Cadillac, it's midnight sunroof is down
Three shots rung out the hero's dead, the new king is crowned

[Chorus]
Black coat, white shoes, black hat, Cadillac
Yeah! The boy's a time bomb
Black coat, white shoes, black hat, Cadillac
Yeah! The boy's a time bomb

Black coat, white shoes, black hat, Cadillac
Yeah! The boy's a time bomb
Black coat, white shoes, black hat, Cadillac
Yeah! The boy's a time bomb

Ohh, time bomb!

"
274,Stupid Girl,Garbage,Garbage,1995-01-01,258533,7,"

[Verse 1]
You pretend you're high
Pretend you're bored
Pretend you're anything
Just to be adored
And what you need
Is what you get

[Pre-Chorus 1]
Don't believe in fear
Don't believe in faith
Don't believe in anything
That you can't break

[Chorus]
You stupid girl
You stupid girl
All you had, you wasted
All you had, you wasted

[Verse 2]
What drives you on (drives you on)
Can drive you mad (drive you mad)
A million lies to sell yourself
Is all you ever had

[Pre-Chorus 2]
Don't believe in love
Don't believe in hate
Don't believe in anything
That you can't waste

[Chorus]
You stupid girl
You stupid girl
Can't believe you fake it
Can't believe you fake it

[Instrumental break]

[Pre-Chorus 3]
Don't believe in fear
Don't believe in pain
Don't believe in anyone
That you can't tame

[Chorus]
You stupid girl
You stupid girl
All you had, you wasted
All you had, you wasted
You stupid girl
You stupid girl
I can't believe you fake it
I can't believe you fake it
Stupid girl
You stupid girl
Can't believe you fake it
Can't believe you fake it

[Outro]
You stupid girl

"
275,Name,A Boy Named Goo,The Goo Goo Dolls,1995-03-10,270000,65,"

[Verse 1]
And even though the moment passed me by
I still can't turn away
'Cause all the dreams you never thought you'd lose
Tossed along the way
Letters that you never meant to send
Get lost or thrown away

[Chorus 1]
And now we're grown-up orphans
That never knew their names
We don't belong to no one
That's a shame
You could hide beside me
Maybe for a while
And I won't tell no one your name
And I won't tell 'em your name

[Verse 2]
Scars are souvenirs you never lose
The past is never far
Did you lose yourself somewhere out there?
Did you get to be a star?
And don't it make you sad to know that life
Is more than who we are?

[Chorus 2]
You grew up way too fast
And now there's nothing to believe
And reruns all become our history
A tired song keeps playing on a tired radio
And I won't tell no one your name
And I won't tell 'em your name

[Bridge]
I won't tell 'em your name
I won't tell 'em your name

[Outro]
I think about you all the time
But I don't need the same
It's lonely where you are
Come back down
And I won't tell 'em your name

"
276,Peaches,The Presidents of The United States of America: Ten Year Super Bonus Special Anniversary Edition,The Presidents Of The United States Of America,1995,171693,63,"

[Chorus]
Movin' to the country
I'm gonna eat a lot of peaches
Movin' to the country
I'm gonna eat me a lot of peaches
Movin' to the country
I'm gonna eat a lot of peaches
Movin' to the country
I'm gonna eat a lot of peaches

[Verse 1]
Peaches come from a can
They were put there by a man
In a factory downtown
If I had my little way
I'd eat peaches every day
Sun-soakin' bulges in the shade

[Chorus]
Movin' to the country
I'm gonna eat a lot of peaches
Movin' to the country
I'm gonna eat me a lot of peaches
Movin' to the country
I'm gonna eat a lot of peaches
Movin' to the country
I'm gonna eat a lot of peaches

[Verse 2]
I took a little nap where the roots all twist
Squished a rotten peach in my fist
And dreamed about you, woman
I poked my finger down inside
Make a little room for an ant to hide
Nature's candy in my hand or can or a pie

[Outro]
Millions of peaches, peaches for me
Millions of peaches, peaches for free
Millions of peaches, peaches for me
Millions of peaches, peaches for free (Look out!)
Millions of peaches, peaches for me
Millions of peaches, peaches for free
Millions of peaches, peaches for me
Millions of peaches, peaches for free
Millions of peaches, peaches for me
Millions of peaches, peaches for free
Millions of peaches, peaches for me
Millions of peaches, peaches for free (Look out!)

"
277,Good,Deluxe,Better Than Ezra,1995-02-28,185093,62,"

Looking around the house
Hidden behind the window and the door
Searching for signs of life
But there's nobody home

Well, maybe I'm just too sure
Or maybe I'm just too frightened by the sound of it
Pieces of note fall down, but the letter said

[Chorus:]
Aha, it was good
Living with you, aha, it was good
Ah-ah-ah-ah-aha it was good
Living with you, aha, it was good
Ah-ah-ah, good good good

Sitting around the house
Watching the sun trace the shadow on the floor
Searching for signs of life
But there's nobody home
Well, maybe I'll call or I'll write you a letter
Now maybe we'll see on the fourth of July
But I'm not too sure, and I'm not too proud
Well I'm not sure, and I'm not too proud to say

[Chorus: x2]

Yeah, you were so good
Yeah, you were so good
Yeah, that's right

"
278,Just A Girl,Tragic Kingdom,No Doubt,1995-10-10,208400,63,"

[Verse 1]
Take this pink ribbon off my eyes
I'm exposed, and it's no big surprise
Don't you think I know exactly where I stand?
This world is forcing me to hold your hand

[Chorus]
'Cause I'm just a girl, oh, little old me
Well, don't let me out of your sight
Oh, I'm just a girl, all pretty and petite
So don't let me have any rights

[Post-Chorus]
Oh, I've had it up to here

[Verse 2]
The moment that I step outside
So many reasons for me to run and hide
I can't do the little things I hold so dear
'Cause it's all those little things that I fear

[Chorus]
'Cause I'm just a girl, I'd rather not be
'Cause they won't let me drive late at night
Oh, I'm just a girl, guess I'm some kind of freak
'Cause they all sit and stare with their eyes
Oh, I'm just a girl, take a good look at me
Just your typical prototype

[Post-Chorus]
Oh, I've had it up to here
Oh, am I making myself clear?

[Bridge]
I'm just a girl
I'm just a girl in the world
That's all that you'll let me be

[Chorus]
Oh, I'm just a girl, living in captivity
Your rule of thumb makes me worrisome
Oh, I'm just a girl, what's my destiny?
What I've succumbed to is making me numb
Oh, I'm just a girl, my apologies
What I've become is so burdensome
Oh, I'm just a girl, lucky me
Twiddle-dum, there's no comparison

[Outro]
Oh, I've had it up to
Oh, I've had it up to
Oh, I've had it up to here

"
279,Santa Monica,Sparkle And Fade,Everclear,1995-01-01,191506,69,"

[Verse 1]
I am still living with your ghost
Lonely and dreaming of the west coast
I don't want to be your downtime
I don't want to be your stupid game

[Verse 2]
With my big black boots and an old suitcase
I do believe I'll find myself a new place
I don't want to be the bad guy
I don't want do your sleepwalk dance anymore
I just want to see some palm trees
I will try and shake away this disease

[Chorus]
We could live beside the ocean
Leave the fire behind
Swim out past the breakers
Watch the world die
We could live beside the ocean
Leave the fire behind
Swim out past the breakers
Watch the world die

[Verse 3]
I am still dreaming of your face
Hungry and hollow for all the things you took away
I don't want to be your good time
I don't want to be your fall-back crutch anymore

[Verse 4]
I'll walk right out into a brand new day
Insane and rising in my own weird way
I don't want to be the bad guy
I don't want to do your sleepwalk dance anymore
I just want to feel some sunshine
I just want to find some place to be alone

[Chorus]
We could live beside the ocean
Leave the fire behind
Swim out past the breakers
Watch the world die

"
280,Tomorrow,Frogstomp (Deluxe Edition) [Remastered],Silverchair,1995-03-27,266280,63,"

[Verse 1]
It's twelve o'clock and it's a wonderful day
I know you hate me, but I'll ask anyway
Won't you come with me to a place in a little town?
The only way to get there's to go straight down
There's no bathroom and there is no sink
The water out of the tap is very hard to drink

[Pre-Chorus]
Very hard to drink

[Chorus]
You wait 'til tomorrow
You wait 'til tomorrow

[Verse 2]
You say that money isn't everything
But I'd like to see you live without it
You think you can keep on going living like a king
Ooh, babe, but I strongly doubt it

[Pre-Chorus]
Very hard to drink
Very hard to drink

[Chorus]
You gonna wait 'til, fat boy
Fat boy, wait 'til tomorrow
You gonna wait 'til, fat boy
Fat boy, wait 'til tomorrow

[Chorus]
You wait 'til tomorrow
You wait 'til tomorrow
You gonna wait 'til, fat boy
Fat boy, wait 'til tomorrow
You gonna wait 'til, fat boy
Fat boy, wait 'til tomorrow
Oh, yeah

"
281,Rock And Roll Is Dead,Circus,Lenny Kravitz,1995-09-12,203933,44,"

[Verse 1]
Ooo-oooh, yeah!
You think you're on top of the world
But you know it's really over
Running 'round with diamond rings
And coke spoons that are overflowing
Rock and roll is dead
But all the money in the world
Can't buy you from the place you're going to
Ooo-oooh, yeah

[Chorus]
Rock and roll is dead
Rock and roll is dead
Rock and roll is dead

[Verse 2]
You can't even sing or play an instrument
So you just scream instead
Oooh, yeah
You're living for an image
So you got five hundred women in your bed
Oooh, yeah!
Rock and roll is dead
But it's real hard to be yourself
When you're living with those demons in your head
Ooo-oooh, yeah!

[Chorus]
Rock and roll is dead
Rock and roll is dead
Rock and roll is dead
Rock and roll is dead
Rock and roll is dead
Rock and roll is dead
Rock and roll is dead
Rock and roll is dead
Rock and roll is dead
Rock and roll is dead

"
282,Roll with It,(What's the Story) Morning Glory?,Oasis,1995-10-02,239826,0,"

[Verse 1]
You gotta roll with it
You gotta take your time
You gotta say what you say
Don't let anybody get in your way
'Cause it's all too much for me to take

Don't ever stand aside
Don't ever be denied
You wanna be who you'd be
If you're coming with me
I think I've got a feeling I've lost inside
I think I'm gonna take me away and hide
I'm thinking of things that I just can't abide

[Chorus]
I know the roads down which your life will drive (Life will drive)
I'll find the key that lets you slip inside (Slip inside)
Kiss the girl, she's not behind the door (Behind the door)
But you know I think I recognize your face
But I've never seen you before

[Verse 2]
You've gotta roll with it
You've gotta take your time
You gotta say what you say
Don't let anybody get in your way
'Cause it's all too much for me to take

[Guitar Solo]

[Chorus]
I know the roads down which your life will drive (Life will drive)
I'll find the key that lets you slip inside (Slip inside)
Kiss the girl, she's not behind the door (Behind the door)
But you know I think I recognize your face
But I've never seen you before

[Verse 3]
You gotta roll with it
You gotta take your time
You gotta say what you say
Don't let anybody get in your way
'Cause it's all too much for me to take

Don't ever stand aside
Don't ever be denied
You wanna be who you'd be
If you're coming with me
I think I've got a feeling I've lost inside (Take me away)
I think I've got a feeling I've lost inside (Take me away)
I think I've got a feeling I've lost inside (Take me away)

[Outro]
I think I've got a feeling I've lost inside (Take me away)
I think I've got a feeling I've lost inside (Take me away)
I think I've got a feeling I've lost inside (Take me away)
I think I've got a feeling I've lost inside (Take me away)
I think I've got a feeling I've lost inside (Take me away)
I think I've got a feeling I've lost inside (Take me away)
I think I've got a feeling I've lost inside (Take me away)
I think I've got a feeling I've lost inside (Take me away)

"
283,Alright,I Should Coco,Supergrass,1995-05-15,180880,71,"

[Verse 1]
We are young, we run green
Keep our teeth nice and clean
See our friends, see the sights
And feel alright

[Verse 2]
We wake up, we go out
Smoke a fag, put it out
See our friends, see the sights
And feel alright

[Chorus]
Are we like you?
I can't be sure
Of the scene as she turns
We are strange in our worlds

[Verse 3]
But we are young, we get by
Can't go mad, ain't got time
Sleep around if we like
But we're alright

[Verse 4]
Got some cash, bought some wheels
Took it out 'cross the fields
Lost control, hit a wall
But we're alright

[Chorus]
Are we like you?
I can't be sure
Of the scene as she turns
We are strange in our worlds

[Verse 1]
But we are young, we run green
Keep our teeth nice and clean
See our friends, see the sights
And feel alright

[Chorus]
Are we like you?
I can't be sure
Of the scene as she turns
We are strange in our worlds

[Verse 1]
But we are young, we run green
Keep our teeth nice and clean
See our friends, see the sights
And feel alright...

"
284,Spiderwebs,Tragic Kingdom,No Doubt,1995-10-10,266733,49,"

[Verse 1]
You think that we connect
That the chemistry's correct
Your words walk right through my ears
Presuming I like what I hear

[Pre-Chorus]
And now I'm stuck in the
The web you're spinning
You got me for your prey

[Chorus]
Sorry I'm not home right now
I'm walking into spiderwebs
So leave a message and I'll call you back
A likely story, but
Leave a message and I'll call you back

[Verse 2]
You're intruding on what's mine
And you're taking up my time
Don't have the courage inside me
To tell you, ""Please let me be""

[Pre-Chorus]
Communication
A telephonic invasion
I'm planning my escape

[Chorus]
Sorry I'm not home right now
I'm walking into spiderwebs
So leave a message and I'll call you back
A likely story, but
Leave a message and I'll call you back

[Post-Chorus]
And it's all your fault
I screen my phone calls
No matter who calls
I gotta screen my phone calls

[Bridge]
Now it's gone too deep (Now it's gone too deep)
You wake me in my sleep (Wake me in my sleep)
My dreams become nightmares (Dreams become nightmares)
'Cause you're ringing in my ears

[Chorus]
Sorry I'm not home right now
I'm walking into spiderwebs
So leave a message and I'll call you back
A likely story, but
Leave a message and I'll call you back

[Post-Chorus]
And it's all your fault
I screen my phone calls
No matter, matter, matter, matter who calls
I gotta screen my phone calls

[Chorus]
Ooh, spiderwebs
Leave a message and I'll call you back
I'm walking into spiderwebs
So leave a message and I'll call you back

[Post-Chorus]
It's all your fault
I screen my phone calls
No matter, matter, matter who calls
I gotta screen my phone calls
It's all your fault
It's all your fault
No matter who calls
No matter who calls

[Chorus]
Ooh, I'm walking into spiderwebs
So leave a message and I'll call you back, ha-ha
I'm walking into spiderwebs
Leave a message and I'll call you back

[Outro]
Oh, it's all your fault (I'm walking into spiderwebs)
No matter who calls (Leave a message and I'll call you back)
I gotta screen my phone calls (I'm walking into spiderwebs)
It's all your fault (Leave a message and I'll call you back)
No matter, matter, matter who calls (I'm walking into spiderwebs)
I screen my phone calls (Leave a message and I'll call you back)
I'm walking into spiderwebs
Leave a message and I'll call you back

"
285,Ruby Soho,...And Out Come The Wolves,Rancid,1995-08-15,157533,59,"

[Verse 1]
Echoes of reggae comin' through my bedroom wall
Having a party up next door but I'm sittin here all alone
Two lovers in the bedroom and the other starts to shout
All I got is this blank stare and that don't carry no clout at all

[Chorus]
Destination unknown
Ruby Ruby Ruby Ruby Soho
Destination unknown
Ruby Ruby Ruby Ruby Soho

[Verse 2]
He's singing and she's there to lend a hand
He's seen his name on the marquee but she will never understand
Once again he's leavin' and she's there with a tear in her eye
Embraces with a warm gesture it's time, time to say goodbye

[Chorus]
Destination unknown
Ruby Ruby Ruby Ruby Soho
Destination unknown
Ruby Ruby Ruby Ruby Soho

[Verse 3]
Ruby's heart ain't beatin' cause she knows the feelin' is gone
She's not the only one who knew there's somethin' wrong
Her lover's in the distance as she wipes a tear from her eye
Ruby's fading out, she disappears, it's time, time to say goodbye

[Chorus]
Destination unknown
Ruby Ruby Ruby Ruby Soho
Destination unknown
Ruby Ruby Ruby Ruby Soho

[Bridge]
Ruby Ruby Ruby Ruby Soho
Ruby Ruby Ruby Ruby Soho
Ruby Ruby Ruby Ruby Soho
Ruby Ruby Ruby Ruby Soho

[Outro]
Destination unknown (Ruby Ruby Ruby Ruby Soho)
Ruby Ruby Ruby Ruby Soho
Destination unknown (Ruby Ruby Ruby Ruby Soho)
Ruby Ruby Ruby Ruby Soho

"
286,Hard as a Rock,Ballbreaker,AC/DC,1995-09-22,271000,60,"

[Verse 1]
A rolling rock, electric shocks
She gives a lickin' that don't stop
She light 'em up, push you 'round
Smokin' rings goin' 'round and 'round

[Pre-Chorus]
Her hot potatoes
Will elevate you
Her bad behavior
Will leave you standin' proud
An' hard as a rock

[Chorus]
Hard as a rock
Well, it's harder than a rock
Hard as a rock
Well, it's harder than a rock

[Verse 2]
The lightnin' rod strike it hot
It's gonna hit you like the Rushmore rock
No nicotine and no pipe dreams
So low and dirty, it's down right mean

[Pre-Chorus]
Hell elevator
Yeah, I'll see you later
No, I ain't going to take it
Yes, I'm
I'm busting out
I'm hard as a rock

[Chorus]
Hard as a rock
Well, it's harder than a rock
Hard as a rock
Well, it's harder than a rock

[Bridge 1]
Hard as a rock
Harder than a rock
Hard as a rock
Yeah

I'm gettin' harder

[Solo]

Harder than a rock

[Bridge 2]
Well, I'm harder than a rock
Hard as a rock
Babe, I'm harder than a rock, yeah

[Chorus]
Hard as a rock
Well, it's harder than a rock
Hard as a rock
Well, it's harder than a rock

"
287,Roll To Me,Twisted,Del Amitri,1995-01-01,132306,59,"

Look around your world pretty baby
Is it everything you hoped it'd be
The wrong guy, the wrong situation
The right time to roll to me
Roll to me

Look into your heart pretty baby
Is it aching with some nameless need
Is there something wrong and you can't put your finger on it
Right then, roll to me

And I don't think I have ever seen a soul so in despair
So if you want to talk the night through
Guess who will be there?

So don't try to deny it pretty baby
You've been down so long you can hardly see
When the engine's stalled and it won't stop raining
It's the right time to roll to me
Roll to me, Roll to me

So look around your world pretty baby
Is it everything you hoped it'd be
The wrong guy, the wrong situation
The right time to roll to me
The right time to roll to me
The right time to roll to me
OOOOOHHHHH

"
288,Can't Get You Off My Mind,Circus,Lenny Kravitz,1995-09-12,274000,59,"

[Verse 1]
Life is just a lonely highway
I'm out here on the open road
I'm old enough to see behind me
But young enough to feel my soul
I don't want to lose you baby
And I don't want to be alone
Don't want to live my days without you
But for now I've got to be without you

[Chorus]
I've got a pocket full of money
And a pocket full of keys that have no bounds
But then I think of loving
And I just can't get you off of my mind
Yeah...

[Verse 2]
Babe, can't you see
That this is killing me?
I don't want to push you baby
And I don't want you to be told
It's just that I can't breathe without you
Feel like I'm going to lose control

[Chorus]
I've got a pocket full of money
And pocket full of keys that have no bounds
But when it comes to loving
I just can't get you off of my mind
Yeah...

[Verse 3]
Am I a fool to think that there's a little hope
Yeah yeahhhhhheee yeah
Tell me baby, yeah
What are the rules the reasons and the do's and don'ts
Yeah yeahhhhhheee yeah
Tell me baby tell me baby, yeah
What do you feel inside?

[Chorus]
I've got a pocket full of money
And a pocket full of keys that have no bounds
Oh yeah
But when it comes down to loving
I just can't get you off of my mind
Yeah...
I just can't get you off of my mind
Yeah...

"
289,When Love And Hate Collide,The Story So Far: The Best Of Def Leppard,Def Leppard,2018-11-30,256866,57,"

[Verse 1]
You could have a change of heart, if you would only change your mind
Instead of slamming down the phone girl, for the hundredth time
I got your number on my wall, but I ain't gonna make that call
When divided we stand baby, united we fall

[Pre-Chorus]
Got the time got a chance gonna make it
Got my hands on your heart gonna take it
All I know I can't fight this flame
You could have a change of heart, if you would only change your mind
Cause I'm crazy 'bout you baby, time after time

[Chorus]
Without you
One night alone
Is like a year without you baby
Do you have a heart of stone
Without you
Can't stop the hurt inside
When love and hate collide

[Verse 2]
I don't wanna fight no more, I don't know what we're fighting for
When we treat each other baby, like an act of war
I could tell a million lies and it would come as no surprise
When the truth is like a stranger, hits you right between the eyes

[Pre-Chorus]
There's a time and a place and a reason
And I know I got a love to believe in
All I know got to win this time

[Chorus]
Without you
One night alone
Is like a year without you baby
Do you have a heart of stone
Without you
Can't stop the hurt inside
When love and hate collide

[Bridge]
You could have a change of heart, if you would only change your mind
Cause I'm crazy 'bout you baby...Crazy...Crazy

[Chorus]
Without you
One night alone
Is like a year without you baby
Do you have a heart of stone
Without you
One night alone
Is like a year without you baby
If you have a heart at all
Without you
Can't stop the hurt inside
When love and hate collide

"
