,name,album,artist,release date,length,popularity,lyrics
0,Thunderstruck,The Razors Edge,AC/DC,1990-09-24,292880,81,"

[Intro]
Thunder, ah
Thunder, ah
Thunder, ah
Thunder, ah
Thunder, ah
Thunder, ah
Thunder, ah
Thunder, ah
Thunder, ah
Thunder, ah

[Verse 1]
I was caught
In the middle of a railroad track (Thunder)
I looked 'round
And I knew there was no turning back (Thunder)
My mind raced
And I thought, what could I do? (Thunder)
And I knew
There was no help, no help from you (Thunder)
Sound of the drums
Beating in my heart
The thunder of guns
Tore me apart

[Chorus]
You've been - thunderstruck

[Verse 2]
Went down the highway
Broke the limit, we hit the town
Went through to Texas
Yeah, Texas, and we had some fun
We met some girls
Some dancers who gave a good time
Broke all the rules, played all the fools
Yeah-yeah, they, they, they blew our minds

[Pre-Chorus]
I was shaking at the knees
Could I come again please?
Yeah, the ladies were too kind

[Chorus]
You've been - thunderstruck, thunderstruck
Yeah-yeah-yeah, thunderstruck
Oh, thunderstruck
Yeah

[Bridge 1]
I was shaking at the knees
Could I come again please?
Yow

[Solo]

[Chorus]
Thunderstruck, thunderstruck
Yeah-yeah-yeah, thunderstruck
Thunderstruck, yeah, yeah, yeah
Said

[Bridge 2]
Yeah, it's alright
We're doing fine
Yeah, it's alright
We're doing fine, so fine

[Chorus]
Thunderstruck, yeah-yeah-yeah
Thunderstruck, thunderstruck, thunderstruck
Whoa, baby, baby (Thunderstruck)
You've been thunderstruck, thunderstruck
Thunderstruck, thunderstruck
You've been thunderstruck

"
1,Wind Of Change,Crazy World,Scorpions,1990-01-01,312360,77,"

[Intro]
(Whistling)

[Verse 1]
I follow the Moskva
Down to Gorky Park
Listening to the wind of change
An August summer night
Soldiers passing by
Listening to the wind of change
(Whistling)

[Verse 2]
The world is closing in
And did you ever think?
That we could be so close?
Like brothers
The future's in the air
I can feel it everywhere
Blowing with the wind of change

[Chorus]
Take me to the magic of the moment
On a glory night
Where the children of tomorrow dream away (dream away)
In the wind of change
(mmmmmmm)

[Verse 3]
Walking down the street
And distant memories
Are buried in the past forever
I follow the Moskva
And down to Gorky Park
Listening to the wind of change

[Chorus]
Take me (take me) to the magic of the moment
On a glory night (glory night)
Where the children of tomorrow share their dreams (share their dreams)
With you and me (you and me)
Take me (take me) to the magic of the moment
On a glory night (a glory night)
Where the children of tomorrow dream away (dream away)
In the wind of change (wind of change)

[Bridge]
The wind of change blows straight
Into the face of time
Like a storm wind that will ring
The freedom bell for peace of mind
Let your balalaika sing
What my guitar wants to sing (sing)

[Guitar solo]

[Chorus]
Take me (take me) to the magic of the moment
On a glory night (a glory night)
Where the children of tomorrow share their dreams (share their dreams)
With you and me (you and me)
Take me (take me) to the magic of the moment
On a glory night (a glory night)
Where the children of tomorrow dream away (dream away)
In the wind of change (wind of change)

[Outro]
(Whistling)

"
2,Hard To Handle,Shake Your Money Maker,The Black Crowes,1990-02-13,188066,69,"

[Intro]
Yeah, make some noise

[Verse 1]
Baby, here I am, a man on the scene
I give you what you want, got you comin' home with me
Got all my love, little more in store
Get through throwin' it on you, you got to come back for more

[Chorus]
Boys and things that come by the dozen, did you know?
That ain't nothin' but drugstore lovin'
Pretty little thing, let me light your candle
'Cause, mama, I'm sure hard to handle now, yes, sir, I am

[Verse 2]
Action speaks louder than words, man of experience
Got you another man, I can love you better than him
Man, don't be afraid, prove every word I say
Advertising love for free, place your ad with me

[Chorus]
Boys like dimes around by the dozen, ten cent lovin'
Pretty little thing, let me light your candle
'Cause, mama, I'm sure hard to handle now, yes, sir, I am
Yeah, gotta get it hard

[Verse 3]
Baby, I am, on the scene
Give you, give you, give you what you want, baby
Come on home with me
Got all my love, little more in store
Throwin' shit on you, back for more

[Chorus]
Boys like dimes around by the dozen, drugstore love
Pretty little thing, let me light your candle
'Cause, mama, I'm sure hard to handle now, yes, sir, I am
Yeah, got to get hard
Jeffrey Cease

[Instrumental Break]

[Chorus]
Boys like dimes around by the dozen, ten cent love
(Pretty little thing, let me light your candle)
('Cause, mama, I'm sure hard to handle now)
You did good!
Nicely done, nicely done

[Instrumental Break]

[Outro]
[? 2:50 'til the morning]
One time
Alright
Thank you so much!
This song, we call it ""Shake, Shake, Shake, Shake, Shake 'Em On Down""

"
3,More Than Words,Extreme II - Pornograffitti,Extreme,1990-01-01,334040,67,"

[Verse 1: Gary Cherone]
Saying ""I love you""
Is not the words I want to hear from you
It's not that I want you
Not to say, but if you only knew
How easy it would be to show me how you feel
More than words is all you have to do to make it real
Then you wouldn't have to say that you love me
'Cause I'd already know

[Chorus]
What would you do if my heart was torn in two?
More than words to show you feel
That your love for me is real
What would you say if I took those words away?
Then you couldn't make things new
Just by saying, ""I love you""

Da-de-da-la-de-da
La-de-dei-dei-dei
More than words
Da-de-da-la-de-da

[Verse 2: Gary Cherone]
Now that I've tried to talk to you and make you understand
All you have to do is close your eyes
And just reach out your hands and touch me
Hold me close, don't ever let me go
More than words is all I ever needed you to show
Then you wouldn't have to say that you love me
'Cause I'd already know

[Chorus]
What would you do if my heart was torn in two?
More than words to show you feel
That your love for me is real
What would you say if I took those words away?
Then you couldn't make things new
Just by saying, ""I love you""

Da-de-da-la-de-da
La-de-dei-dei-dei
More than words
Da-de-da-la-de-da
La-de-dei-dei-dei
More than words
La-de-dei-dei-dei
La-de-dei-dei-dei
La-de-dei-dei-dei
More than words
More than words

[Outro]
More than words

"
4,Suicide Blonde,X (Remastered),INXS,1990,232626,58,"

Don't you know what you're doing?
You've got a death wish

[Yeah?]

Suicide blonde, suicide blonde
Suicide blonde, suicide blonde
Suicide blonde was the colour of her hair
Like a cheap distraction
For a new affair
She knew it would finish
Before it began
Woah baby, you lost the plan

You want to make her
Suicide Blonde
Love devastation
Suicide Blonde

You want to make her
Suicide Blonde
Love devastation
Suicide Blonde

She stripped to the beat
But her clothes stay on
White light everywhere
But you can't see a thing
Such a squeeze
A mad, sad moment
Glory to you, glory to you, take me there

Oooo, take me there
Ow

Got some revelation put into your hands
Save you from your misery
Like rain across the land
Don't you see
The colour of deception
Turning your world around again

You want to make her
Suicide Blonde
Love devastation
Suicide Blonde

You want to make her
Suicide Blonde
Love devastation
Suicide Blonde

Say it:
You want to make
You want to make

You want to make her
Suicide Blonde
You want to make

Ow

That's the story
Everything you wanna be
Everything you are, are

Mmmmm
Yeah

You want to make her
Suicide Blonde
Love devastation
Suicide Blonde

You want to make her
Suicide Blonde
Love devastation
Suicide Blonde
Yeah
Love
You want to make her
Suicide Blonde
Love devastation
Suicide Blonde
You want to make her

"
5,Moneytalks,The Razors Edge,AC/DC,1990-09-24,225946,63,"

Yeah!

[Verse 1]
Tailored suits, chauffeured cars
Fine hotels and big cigars
Up for grabs, all for a price
Where the red hot girls keep on dancing through the night

[Pre-Chorus]
The claim is on you, the sights are on me
So what do you do that's guaranteed?
Hey little girl, you want it all
The furs, the diamonds
The paintings on the wall

[Chorus]
Come on, come on, lovin' for the money
Come on, come on, listen to the money talk
Come on, come on, lovin' for the money
Come on, come on, listen to the money talk

[Verse 2]
A French maid, foreign chef
A big house, with king-size beds
You had enough, you ship them out
The dollar's up, down, you better buy the Pound

[Pre-Chorus]
The claim is on you, the sights are on me
So what do you do that's guaranteed?
Hey little girl, you break the laws
You hustle, you deal
You steal from us all

[Chorus]

[Bridge 1]
Money talks
Yeah-yow!

[Solo]

[Bridge 2]
Money talks
B.S. walks
Money talks
Come on, come on

[Chorus]

[Outro]
Money talks
Money talk, talk, talk
Oh, hear it talk
Yeah, yeah-yeah!
Moneytalk!

"
6,While My Guitar Gently Weeps,Hell To Pay,The Jeff Healey Band,1990-05-21,315666,54,"

I look at you all, see the love there that's sleeping
While my guitar gently weeps
I look at the floor and I see it needs sweeping
Still my guitar gently weeps

I don't know why nobody told you
How to unfold your love
I don't know how someone controlled you
They bought and sold you

I look at the world and I notice it's turning
While my guitar gently weeps
From every mistake, we must surely be learning
And still my guitar gently weeps

I don't know how you were diverted
You were perverted, too
I don't know how you were inverted
No one alerted you

I look at you all, see the love there that's sleeping
While my guitar gently weeps
Look at you all
Still my guitar gently weeps

"
7,All I Wanna Do Is Make Love To You,Brigade,Heart,1990-03-25,310893,66,"

It was a rainy night
When he came into sight
Standing by the road
With no umbrella, no coat

So I pulled up along side
And I offered him a ride
He accepted with a smile
So we drove for a while

I didn't ask him his name
This lonely boy in the rain
Fate, tell me it's right
Is this love at first sight?
Please don't make it wrong
Just stay for a night

All I wanna do is make love to you
Say you will, you want me too
All I wanna do is make love to you
I got loving arms to hold onto

So we found this hotel
It was a place I knew well
We made magic that night
Oh, he did everything right

He brought the woman out of me
So many times, easily
And in the morning, when he woke
All I left him was a note

I told him I am the flower
You are the seed
We walked in the garden
We planted a tree

Don't try to find me
Please don't you dare
Just live in my memory
You'll always be there

All I wanna do is make love to you
One night of love was all we knew
All I wanna do is make love to you
I got loving arms to hold onto

Whoa, oh, we made love
Love like strangers
All night long
We made love

Then it happened one day
We came 'round the same way
You can imagine his surprise
When he saw his own eyes

I said, ""Please, please understand
I'm in love with another man
And what he couldn't give me, oh, whoa
Was the one little thing that you can""

All I wanna do is make love to you
One night of love was all we knew
All I wanna do is make love to you
Come on, say you will, you want me too

All I wanna do is make love to you
One night of love was all we knew
All I wanna do is make love to you
Say you will, baby, want me too

All night long, all night long
All night long, all night long

All I wanna do, all I wanna do
All I wanna do, all I wanna do

All I wanna do is make love to you
One night of love was all we knew

"
8,Unskinny Bop,Flesh & Blood,Poison,1990,228066,61,"

[Verse 1]
A-what's got you so jumpy?
Why can't you sit still, yeah?
Like gasoline, you wanna pump me
And leave me when you get your fill, yeah

Every time I touch you, honey, you get hot
I wanna make love, you never stop
Come up for air, you pull me to the floor
What's been going on in that head of yours?

[Chorus]
Unskinny bop
Just blows me away, yeah
Unskinny bop, bop
All night and day, yeah
Unskinny bop, bop, bop, bop
She just loves to play, yeah
Unskinny bop, nothin' more to say

[Verse 2]
You look at me so funny
Love bite got you acting oh so strange
You got too many bees in your honey
Am I just another word in your page, yeah, yeah?

Every time I touch you, honey, you get hot
I wanna make love, you never stop
Come up for air, you pull me to the floor
What's been going on in that head of yours?

[Chorus]
Unskinny bop
Just blows me away, yeah
Unskinny bop, bop
All night and day, yeah
Unskinny bop, bop, bop, bop
She just loves to play, yeah
Unskinny bop, nothin' more to say

[Bridge]
You're saying my love won't do ya
That ain't love written on your face
Well, honey, I can see right through ya
Well, who's ridin' who at the end of the race?

What's right?
What's wrong?
What's left?
What the hell is going on?

[Chorus & outro]
Unskinny bop
Just blows me away, yeah
Unskinny bop, bop
All night and day, yeah
Unskinny bop, bop, bop, bop
She just loves to play, yeah
(Up for air, pulled to the floor)
Unskinny bop
No good, no good, no good, no good
Unskinny bop, bop
All night and day, yeah
Unskinny bop, bop, bop, bop
No good, no good, no good, no good

"
9,Hole Hearted,Extreme II - Pornograffitti,Extreme,1990-01-01,219400,44,"

[Intro]
Oooh yeah wooh!
Hey, hey, hey, hey, hey, yeah

[Verse 1]
Life´s ambition occupy my time
Priorities confuse the mind
Happiness one step behind
This inner peace I've yet to find

[Pre-Chorus]
Rivers flow into the sea
Yet even the sea is not so full of me
If I´m not blind why can't I see
That a circle can´t fit where a square should be?

[Chorus]
There´s a hole in my heart
That can only be filled by you
And this hole in my heart
Can´t be filled with the things I do
Hole hearted
Hole hearted

[Verse 2]
This heart of stone is where I hide
These feet of clay keep warm inside
Day by day less satisfied
Not fade away before I die

[Pre-Chorus]
Rivers flow into the sea
Yet even the sea is not so full of me
If I´m not blind why can´t I see
Ooh, that a circle can´t fit where a square should be?

[Chorus]
There´s a hole in my heart
That can only be filled by you
And this hole in my heart
Can´t be filled with the things I do

[Chorus 2]
There´s a hole in my heart
That can only be filled by you
Should have known from the start
I´d fall short with the things I do
Hole hearted,  hole hearted
Hole hearted,  hole hearted

[Outro]
Hole hearted,  hole hearted
Yeah
Yee haw!

"
10,Send Me An Angel,Crazy World,Scorpions,1990-01-01,273333,69,"

[Verse 1]
Wise man said just walk this way
To the dawn of the light
The wind will blow into your face
As the years pass you by
Hear this voice from deep inside
It's the call of your heart
Close your eyes and you will find
Passage out of the dark

[Chorus]
Here I am
Will you send me an angel?
Here I am
In the land of the morning star!

[Verse 2]
Wise man said just find your place
In the eye of the storm
Seek the roses along the way
Just beware of the thorns

[Chorus]
Here I am
Will you send me an angel?
Here I am
In the land of the morning star!

[Verse 3]
Wise man said just raise your hand
And reach out for the spell
Find the door to the promised land
Just believe in yourself
Hear this voice from deep inside
It's the call of your heart
Close your eyes and you will find
The way out of the dark

[Outro]
Here I am
Will you send me an angel?
Here I am
In the land of the morning star!

Here I am
Will you send me an angel?
Here I am
In the land of the morning star!

Here I am
Will you send me an angel?
Here I am
In the land of the morning star!

Here I am
Will you send me an angel?
Here I am
In the land of the morning star!

"
11,Still Got The Blues,Still Got The Blues,Gary Moore,1990-01-01,370866,67,"

Used to be so easy
To give my heart away
But I found out the hard way
There's a price you have to pay

I found out that love
Was no friend of mine
I should have known
Time after time

So long, it was so long ago
But I've still got the blues for you

Used to be so easy
To fall in love again
But I found out the hard way
It's a road that leads to pain
I found out that love
Was more than just a game
Playing to win
But you lose just the same

So long, it was so long ago
But I've still got the blues for you

So many years since I've seen your face
But here in my heart there's an empty space
Where you used to be

So long, it was so long ago
But I've still got the blues for you

Though the days come and go
There is one thing I know
I've still got the blues for you

"
12,Miracle,Blaze Of Glory,Jon Bon Jovi,1990-01-01,319426,54,"

A penny for your thoughts now baby
Looks like the weight of the world's
On your shoulders now

I know you think you're going crazy
Just when it seems everything's
Gonna work itself out
They drive you right back down

And you said it ain't fair
That a man walks
When a bird can fly
We have to kick the ground
The stars kiss the sky
They say that spirits live
A man has to die
They promised us truth
Now they're giving us lies

Gonna take a miracle to save us this time
And your savior has just left town
Gonna need a miracle
'Cause it's all on the line
And I won't let you down
(No I won't let you down)
The river of your hope is flooding
And I know the dam is busted
If you need me I'll come running
I won't let you down... no, no

You're looking for salvation
You thought that it'd be shining
Like an angel's light
Well, the angels left this nation
And salvation caught the last train
Out tonight
He lost one hell of a fight

He said
I'm just one man, that's all I'll ever be
I never can be everything you wanted from me
I've got plans so big
That any blind man could see
I'm standing in the river
Now I'm drowning in the sea

Gonna take a miracle to save us this time
And your savior has just left town
Gonna need a miracle
'Cause your heart's on the line
And your heartbeat is slowing down
Your feet are grounded still
You're reaching for the sky
You can let 'em clip your wings
'Cause I believe that you can fly

Well my eyes have seen the horror
Of the coming of the flood
I've driven deep the thorny crown
Into the soul of someone's son
Still I'll look you in the eye
'Cause I've believed in things I've thought
And I'll die without regret
For the wars I have fought

Gonna take a miracle to save you this time
And your savior has just left town
Gonna need a miracle
'Cause your heart's doing time
And your conscience is calling you out
It ain't all for nothing
Life ain't written in the sand
I know the tide is coming
But it's time we made a stand
With a miracle

[Outro: Excerpt from Young Guns II (Intro to ""Blaze of Glory"")]
Kiefer Sutherland as Josiah Gordon ""Doc"" Scurlock:
""William H. Bonney, you are not a god""
Cocks his gun and points it at Billy
Emilio Estevez as William H. Bonney:
""Why don't you pull the trigger and find out?""

"
13,High Enough,Damn Yankees,Damn Yankees,1990,287320,58,"

[Verse 1]
I don't wanna hear about it anymore
It's a shame I've got to live without you anymore
There's a fire in my heart
A pounding in my brain
It's driving me crazy

[Verse 2]
We don't need to talk about it anymore
Yesterday's just a memory
Can we close the door
I just made one mistake
I didn't know what to say
When you called me baby

[Pre-Chorus]
Don't say goodnight
Say you're gonna stay forever
Oh, whoa, all the way

[Chorus]
Can you take me high enough
To fly me over (fly me over) yesterday
Can you take me high enough
It's never over
Yesterday's just a memory
(Yesterday's just a memory and)

[Verse 3]
I don't want to live without you anymore
Can't you see I'm in misery
And you know for sure
I would live and die for you
And I know just what to do when you call me baby

[Pre-Chorus]
Don't say goodbye
Say you're gonna stay forever
Oh, whoa, all the way

[Chorus]
Can you take me high enough
Can you fly me over (fly me over) yesterday
Can you take me high enough
It's never over
Yesterday's just a memory

[Bridge]
I'm running
I was running for the door
The next thing I remember
I was running back for more, yeah, yeah yeah yeah

[Pre-Chorus]
Don't say goodbye
Say you're gonna stay forever
Oh, whoa, all the way (all the way, all the way, yeah)

[Chorus]
Can you take me high enough
Can you fly me over (fly me over) yesterday
Can you take me high enough
It's never over, whoa, whoa, whoa, whoa

[Chorus]
Can you take me high enough
Won't you fly me over (won't you fly me over) yesterday
Can you take me high enough
It's never over, whoa, whoa, whoa, whoa

"
14,Man in the Box,Facelift,Alice In Chains,1990-08-01,285200,72,"

[Verse 1: Layne Staley]
I'm the man in the box
Buried in my shit

[Pre-Chorus: Layne Staley]
Won't you come and save me?
Save me

[Chorus: Layne Staley & Jerry Cantrell]
Feed my eyes
(Can you sew them shut?)
Jesus Christ
(Deny your maker)
He who tries
(Will be wasted)
Feed my eyes
(Now you've sewn them) shut

[Verse 2: Layne Staley]
I'm the dog who gets beat
Shove my nose in shit

[Pre-Chorus: Layne Staley]
Won't you come and save me?
Save me

[Chorus: Layne Staley & Jerry Cantrell]
Feed my eyes
(Can you sew them shut?)
Jesus Christ
(Deny your maker)
He who tries
(Will be wasted)
Feed my eyes
(Now you've sewn them) shut

[Guitar Solo: Jerry Cantrell]

[Chorus: Layne Staley & Jerry Cantrell]
Feed my eyes
(Can you sew them shut?)
Jesus Christ
(Deny your maker)
He who tries
(Will be wasted)
Feed my eyes
(Now you've sewn them) shut

"
15,Candy,Brick By Brick,Iggy Pop,1990-06-01,253493,59,"

[Verse 1: Iggy Pop]
It's a rainy afternoon
In 1990
The big city
Geez, it's been 20 years
Candy, you were so fine
Beautiful, beautiful
Girl from the North
You burned my heart
With a flickering torch
I had a dream that no one else could see
You gave me love for free

[Chorus]
Candy, Candy, Candy I can't let you go
All my life you're haunting me
I loved you so
Candy, Candy, Candy I can't let you go
Life is crazy
Candy baby

[Verse 2: Kate Pierson]
Yeah, well it hurt me real bad when you left
I'm glad you got out
But I miss you
I've had a hole in my heart
For so long
I've learned to fake it and
Just smile along
Down on the street
Those men are all the same
I need a love
Not games
Not games

[Chorus] [x2]

[Outro]
Candy, baby
Candy, Candy

"
16,Ride The Wind,Flesh & Blood,Poison,1990,231400,49,"

Hearts of fire
Streets of stone
Modern warriors
Saddle iron horses of chrome

Taste the wild
Lick the wind
Like something they never saw before
Their jaws dropping to the floor
Steel made of soul and sin

Rebels born without a care
And the day he listens
Only to fly where eagles dare
And the night she whispers

Chorus:
Ride the wind
Never coming back until I touch the midnight sun
Ride the wind
Never coming back again
Ride the wind
Never coming back until I touch the midnight sun

Painted flesh
Loyalty
Humble pride
Just as far as the eye can see

Stories told
Two old friends
Of battle scars and lonely bars
And nights the rain wouldn't end

Here's to withered eyes wearing gypsy smiles
And the day he listens
Here's to lovely ladies and a million miles
And the night she whispers

Chorus

Ride the wind
I'm still the bravest soul in sin
Burning till the night is done

Solo

Of all the truths and lies
And stories of riders in the sky
They say only the bravest try
Where eagles and angels dare to fly

Chorus

"
17,"Just the Way It Is, Baby",The Rembrandts,The Rembrandts,1990-08-14,243893,50,"

Do you remember once upon a time
When you were mine
The stars above were bright and new
I pulled them down for you, just when I fell in love again
You said that all good things must end

[Chorus]
Baby, that's just the way it is baby
Baby, that's just the way it is baby

I've never had a hand for solitaire
It's so unfair
That I should have my chance and lose
I feel like I've been used to help you through another night
You spelled it out in black and white

[Chorus]

The tides that once had carried you away
They bring you back today
The time has washed away my pain
I find that things have changed and disappeared without a trace
You can't get back what you've erased
And I say

[Chorus]

"
18,Get The Funk Out,Extreme II - Pornograffitti,Extreme,1990-01-01,263760,46,"

[Verse 1]
If you don't like what you see here
Nobody wants to take you prisoner
So, let me make it nice and clear, dear
The exit is right there
I don't mean to be rude, dude
But you'd better change your attitude
(I don't like what I see here)

[Pre-Chorus]
You're all invited to the party
You know you didn't have to come
No rotten apple's gonna spoil my fun

[Chorus]
If you don't like what you see here
Get the funk out
We won't try to force feed you
Get the funk out

[Interlude]
Hey Patrick!
Not bad, for a pasty-faced white boy!

[Verse 2]
You can't please everybody
But everybody cannot please me
(I don't like what I see here)
That's why I do what I want to
So why don't you do
Do it to, do it to me, hey
And if you don't like what ya see
You can always leave the country
(I don't like what I see here)
Yeah, yeah yeah

[Pre-Chorus]
You're all invited to the party
You know you didn't have to come
No rotten apple's gonna spoil my fun

[Chorus]
If you don't like what you see here
Get the funk out
(Hah, get the funk out, get the funk out)
We won't try to force feed you
Get the funk out
(Ha, now get the funk out, get the funk out)

If you don't like what you see here
(If you don't like what you see here)
Get the funk out
(Get the funk out, get the funk out, get the funk out)
We won't try to force feed you
Get the... funk out

[Instrumental break]

[Guitar Solo]

[Outro]
If you don't like what you see here
Get the funk out
We won't try to force feed you
Get the
If you don't like what you see here
Get the funk out
We won't try to force feed you
Get the funk out
If you don't like what you see here
Get the funk out
We won't try to force feed you
Get the

"
