,name,album,artist,release date,length,popularity,lyrics
140,The Sidewinder Sleeps Tonite,Automatic For The People,R.E.M.,1992-10-05,249360,51,"

[Verse 1]
This here is the place where I will be staying
There isn't a number, you can call the pay phone
Let it ring a long, long, long, long time
If I don't pick up, hang up, call back, let it ring some more
Oh
If I don't pick up, pick up
The sidewinder sleeps, sleeps, sleeps in a coil

[Chorus]
Call me when you try to wake her up
Call me when you try to wake her
Call me when you try to wake her up
Call me when you try to wake her
Call me when you try to wake her up
Call me when you try to wake her
Oh

[Verse 2]
There are scratches all around the coin slot
Like a heartbeat, baby trying to wake up
But this machine can only swallow money
You can't lay a patch by computer design
It's just a lot of stupid, stupid signs
Tell her
Tell her she can kiss my ass
Then laugh and say that you were only kidding
That way she'll know that it's really, really, really, really me

[Chorus]
Call me when you try to wake her up
Call me when you try to wake her
Call me when you try to wake her up
Call me when you try to wake her
Call me when you try to wake her up
Call me when you try to wake her
Oh

[Verse 3]
Baby, instant soup doesn't really grab me
Today I need something more sub-sub-sub-substantial
A can of beans or black-eyed peas, some Nescafe and ice
A candy bar, a falling star, or a reading from Doctor Seuss

[Chorus]
Call me when you try to wake her up
Call me when you try to wake her
Call me when you try to wake her up
Call me when you try to wake her
Call me when you try to wake her up
Call me when you try to wake her

[Verse 4]
The cat in the hat came back
Wreaked a lot of havoc on the way
Always had a smile and a reason to pretend
But their world has flat backgrounds
And little need to sleep but to dream
The sidewinder sleeps on his back

[Chorus]
Call me when you try to wake her up
(Call me when you try to wake her)
Call me when you try to wake her up
(Call me when you try to wake her)
I can always sleep standing up
(Call me when you try to wake her)
Oh
Call me when you try to wake her up
(Call me when you try to wake her)
Call me when you try to wake her up
(Call me when you try to wake her)
I can always sleep standing up
(Call me when you try to wake her)
Oh

[Outro]
Call me when you try to wake her up
(Call me when you try to wake her)
I can always sleep standing up
(Call me when you try to wake her)
I can always sleep standing up
(Call me when you try to wake her)
We've got to boogie, boogie, move on this one

"
141,Wicked Garden,Core,Stone Temple Pilots,1992-09-29,245280,48,"

[Verse 1]
Can you see like a child?
Can you see what I want?
I wanna run through your wicked garden
Heard that's the place to find you
'Cause I'm alive
So alive now
I know the darkness blinds you
Can you see without eyes?
Can you speak without lies?
I wanna drink from your naked fountain
I can drown your sorrows
I'm gonna burn, burn you to life now
Out of the chains that bind you

[Pre-Chorus]
Can you see just like a child?
Can you see just what I want?
Can I bring you back to life?
Are you scared of life?

[Chorus]
Burn, burn, burn
Burn your wicked garden down
Burn, burn, burn
Burn your wicked garden to the ground

[Verse 2]
Can you feel pain inside?
Can you love?
Can you cry?
I wanna run through your wicked garden
Heard that's the place to find you
Cause I'm alive
So alive now
Out of the dark that blinds you

[Pre-Chorus]
Can you see just like a child?
Can you see just what I want?
Can I bring you back to life?
Are you scared of life?

[Chorus]
Burn, burn, burn
Burn your wicked garden down
Burn, burn, burn
Burn your wicked garden to the ground

"
142,Bombtrack,Rage Against The Machine - XX (20th Anniversary Special Edition),Rage Against The Machine,1992,243453,63,"

[Intro]
Uhh
Ayy, yo, it's just another bombtrack, uh
Ayy, yo, it's just another bombtrack, yeah
It goes a one, two, three
Yeah, and it's just another bombtrack

[Verse 1]
And suckers be thinkin' that they can fake this
But I'ma drop it at a higher level
'Cause I'm inclined to stoop down, hand out some beatdowns
Could run a train on punk fools that think they run the game
But I learned to burn that bridge and delete
Those who compete at a level that's obsolete
Instead, I warm my hands upon the flames of the flag
To recall the downfall and the businesses that burnt us all
See through the news and the views that twist reality
Enough, I call the bluff, fuck Manifest Destiny
Landlords and power whores, on my people, they took turns
Dispute the suits, I ignite and then watch 'em burn

[Pre-Chorus]
With the thoughts from a militant mind
Hardline, hardline after hardline
Landlords and power whores, on my people, they took turns
Dispute the suits, I ignite and then watch 'em burn

[Chorus]
Burn, burn, yes, you're gonna burn
Burn, burn, yes, you're gonna burn
Burn, burn, yes, you're gonna burn
Burn, burn, yes, you're gonna burn (Yes, you're gonna)
Burn, burn, yes, you're gonna burn
Burn, burn, yes, you're gonna burn
Burn, burn, yes, you're gonna burn
Burn, burn, yes, you're gonna burn

[Verse 2]
It goes a one, two, three, another funky, radical bombtrack
Started as a sketch in my notebook
And now dope hooks make punks take another look
My thoughts ya hear and ya begin to fear
That ya card will get pulled if ya interfere

[Pre-Chorus]
With the thoughts from a militant, militant mind
Hardline, hardline after hardline
Landlords and power whores, on my people, they took turns
Dispute the suits, I ignite and then watch 'em burn

[Chorus]
Burn, burn, yes, you're gonna burn
Burn, burn, yes, you're gonna burn
Burn, burn, yes, you're gonna burn
Burn, burn, yes, you're gonna burn (Yes, you're gonna)
Burn, burn, yes, you're gonna burn
Burn, burn, yes, you're gonna burn
Burn, burn, yes, you're gonna burn
Burn, burn, yes, you're gonna burn

[Guitar Solo]

[Refrain]
Hey, yo, it's just another bombtrack
Check it out

[Chorus]
Burn, burn, yes, you're gonna burn
Burn, burn, yes, you're gonna burn
Burn, burn, yes, you're gonna burn
Burn, burn, yes, you're gonna burn (Yes, you're gonna)
Burn, burn, yes, you're gonna burn
Burn, burn, yes, you're gonna burn
Burn, burn, yes, you're gonna burn
Burn, burn, yes, you're gonna burn
Burn

"
143,From The Edge Of The Deep Green Sea,Wish,The Cure,1992-01-01,460293,45,"

[Verse 1]
Every time we do this, I fall for her
Wave after wave after wave, it's all for her
""I know this can't be wrong"", I say
(And I'll lie to keep her happy)
As long as I know that you know
That today I belong right here with you
Right here with you

And so we watch the sun come up
From the edge of the deep green sea
And she listens like her head's on fire
Like she wants to believe in me
So I try put your hands in the sky
Surrender, remember
We'll be here forever
And we'll never say goodbye

I've never been so colorfully
See through head before
(I've never been) I've never been so
Wonderfully me you want some more
And all I want is to keep it like this
You and me alone, a secret kiss
And don't go home, don't go away
Don't let this end, please stay

Not just for today

""Never, never, never, never, never let me go"", she says
""Hold me like this for a hundred thousand million days""
But suddenly she slows and looks down at my breaking face
""Why do you cry? What did I say?""
""But it's just rain"", I smile brushing my tears away

[Chorus 1]
I wish I could just stop
I know another moment will break my heart
Too many tears, too many times
Too many years I've cried over you

[Verse 2]
How much more can we use it up?
Drink it dry? Take this drug?
Looking for something forever gone
But something we will always want

""Why, why, why are you letting me go?"" she says
""I feel you pulling back, I feel you changing shape""
And just as I'm breaking free, she hangs herself in front of me
Slips her dress like a flag to the floor
And hands in the sky, surrenders it all

[Chorus 2]
I wish I could just stop
I know another moment will break my heart
Too many tears, too many times
Too many years I've cried for you

[Outro]
It's always the same, wake up in the rain
Head in pain, hung in shame
A different name, same old game, love in vain
And miles and miles and miles and miles and miles
Away from home again

"
144,Dry County,Keep The Faith,Bon Jovi,1992-11-03,592026,48,"

[Intro]
Across the border they turn
Water into wine
Some say it's the devil's blood
They're squeezing from the vine
Some say it's a savior
In these hard and desperate times
You see it helps me to forget
That we're just born to die

[Verse 1]
I came here like so many did
To find a better life
To find my piece of easy street
And finally be alive
I knew nothing good comes easy
All good things take some time
I made my bed, I'll lie in it
To die in it's the crime

You can't help but prosper
Where the streets are paved with gold
They say the oil wells ran deeper here
Than anybody's known
Now I packed up on my wife and kid
And left them both back home
See, there's nothing in this pay dirt
The ghosts are all I know

[Pre-Chorus]
Now the oil's gone
And the money's gone
All the jobs are gone
Still we're hanging on

[Chorus]
Down in dry county
They're swimming in the sand
Praying for some holy water
To wash these sins from off our hands
In dry county
The promise has run dry
Where nobody cries
And no one is getting out of here alive
(Not this time)

[Verse 2]
""In the blessed name of Jesus""
I heard a preacher say
""We are all God's children
And he'd be back, back someday""
I hoped that he knew
Something as he drank that cup of wine
I didn't have too good of a feeling
As I head out to the night

I cursed the sky to open
I begged the clouds for rain
I prayed all night for water
For this burning in my veins (Every night's the same)
It was like my soul's on fire
And I had to watch the flames
All my dreams went up in ashes
And my future blew away

[Pre-Chorus]
Now the oil's gone
And the money's gone
All the jobs are gone
Still we're hanging on

[Chorus]
Down in dry county
They're swimming in the sand
Praying for some holy water
To wash theese sins from off our hands
In dry county
The promise has run dry
Where nobody cries
And no one's getting out of here alive

[Guitar Solo]

[Verse 3]
A man spends his whole life
Waiting praying for some big reward
But it seems sometimes
That payoff leaves you feeling
Like a dirty whore
If I could choose the way I'd die
Make it by the gun or knife
Because the other way there's too much pain
Night after night after night after night

[Chorus]
Oh, down in dry county
They're swimming in the sand
Praying for some holy water
To wash these sins from off our hands
In dry county
The promise has run dry
Where nobody cries
And no one's getting out of here
Dry County
No one is getting out of here
Dry County
No

"
145,Try Not To Breathe,Automatic For The People,R.E.M.,1992-10-05,230573,48,"

[Verse 1]
I will try not to breathe
I can hold my head still with my hands at my knees
These eyes are the eyes of the old
Shivering and fold
I will try not to breathe
This decision is mine
I have lived a full life
And these are the eyes that I want you to remember

[Pre-Chorus]
Oh
I need something to fly over my grave again
I need something to breathe

[Verse 2]
I will try not to burden you
I can hold these inside
I will hold my breath until all these shivers subside
Just look in my eyes
I will try not to worry you
I have seen things that you will never see
Leave it to memory me
I shudder to breathe

[Chorus]
I want you to remember
Oh (You'll never see)
I need something to fly (Something to fly)
Over my grave again (You'll never see)
I need something to breathe (Something to breathe)
Baby, don't shiver now
Why do you shiver now? (I have seen things you will never see)
I need something to fly (Something to fly)
Over my grave again (I have seen things you will never see)
I need something to breathe

[Verse 3]
I will try not to worry you
I have seen things that you will never see
Leave it to memory me
Don't dare me to breathe

[Chorus]
I want you to remember
Oh (You'll never see)
I need something to fly (Something to fly)
Over my grave again (You'll never see)
I need something to breathe (Something to breathe)
Baby, don't shiver now
Why do you shiver? (I have seen things you will never see)
I need something to breathe (Something to breathe)
(I have seen things you will never see)
I want you to remember

"
146,Found Out About You,New Miserable Experience,Gin Blossoms,1992-01-01,233066,36,"

All last summer in case you don't recall
I was yours and you were mine forget it all
Is there a line that I could write
That's sad enough to make you cry?
And all the lines you wrote to me were lies

Months roll past, the love that you struck dead
Did you love me only in my head?
There were things you said and did to me
They seem to come so easily
The love I thought I'd won you give for free

Whispers at the bus stop
Well I've heard about nights out in the school yard
I found out about you
I found out about you

Rumors follow everywhere you go
Like when you left and I was last to know
Well you're famous now and there's no doubt
In all the places you hang out
They know your name and they know what you're about

Whispers at the bus stop
Well I've heard about nights out in the school yard
I found out about you
I found out about you

Street lights blink on through the car window
I get the time too often on AM radio
Well you know it's all I think about
I write your name, drive past your house
Your boyfriend's over, I watch your lights go out

Whispers at the bus stop
Well I've heard about nights out in the school yard
I found out about you
I found out about you

Whispers at the bus stop
Well I've heard about nights out in the school yard
I found out about you
I found out about you

I found about you

"
147,Dear Mr. President,"Bigger, Better, Faster, More !",4 Non Blondes,1992-01-01,283266,42,"

[VERSE]
I'm looking outside of my window
The view that I see
Is a child and mama
And the child is begging for money
Tell me why, tell me why
The woman is blind
Is she so broke
The kid's dealing crime

[Chorus]
It's such a beautiful city
But the word is burning it down

Yea yea yea yea yea yea
Yea yea yea yea yea
It's such a beautiful city
But the world is burning it down

[VERSE]
I go to my room to turn on the tv
I sit myself down
And I start laughing hard
'Cause this man he's asking for money
He says, ""If you send me lots of cash
I'll send you stuff to make you rich fast.""

[Chorus]
It's such a wonderful country
But the man, he's burning it down

Yea yea yea yea yea yea
Yea yea yea yea yea
It's such a wonderful country
But the man he's burning it down

Yea yea yea yea yea yea
Yea yea yea yea yea
And it's burning down
And it's called the US of A

[BRIDGE]
One day I'm going to have lots of money
But I'll have to give it up for this rich society, oh
Oh please Mr. President will you lend me a future?
'Cause you'll just get it back
From the little blind woman
With the kid on the corner
And the people all over, doin' crack

[Chorus]
Yea yea yea yea yea yea
Yea yea yea yea yea
It's such a wonderful country
But the man he's burning it down
Sing it -
Yea yea yea yea yea yea
Yea yea yea yea yea
And it's burning down
And it's called the US of A

[VERSE]
I'm walking outside on a sunny day
With no one around
And I wonder what's wrong
Then I hear this loud piercing siren
Oh my God the bomb has just dropped
And everybody climbed right on top screaming

[Chorus]
""What a wonderful country
But the man he's burning it down
He's burning it down""

Yea yea yea yea yea yea
Yea yea yea yea yea
It's such a wonderful country
But the man he's burning it down
He's burning it down

Yea yea yea yea yea yea
Yea yea yea yea yea

And it's burning down, and it's called the US of A

"
148,I Wonder,Blind Melon,Blind Melon,1992-01-01,332666,38,"

[Intro]
All alone, the broadening skies
Under thee, every night, I lie (every night, I will lie)
Scratch and claw and grip the rails
Every day, my living hell
Oh God, you know I try
I know how hard I try, you know I try

[Verse 1]
Hey, I'd like to daze away
To a place no one has known
In a state of mind I could call mine
That only I could own
Where I can hum a tune anytime I choose
And there's no such thing as time
Where I feel no pain, just calm and sane
What a place for one to find

[Chorus]
Now, you see
I'm watching everything I do
And they're watching everything I say
So they will leave me be
Whoa, leave me be

[Bridge]
(Sometimes, I gotta ask myself, I said)
Why am I even here?
And I wonder
You leave me wondering
You leave me wondering

[Solo]

[Chorus]
Won't you stop watching me?
I said, they're watching me, watching me, watching me, yeah

[Verse 2]
Now, in my corner
I got their stealin' in my eyes, and
And arms holding up my knees
And, man, rocking back and forth's my life
I didn't mean to feel this way
When I walked into the door
And they ripped away my memories
And I can't remember who I was before
Lord, no, Lord, no

[Chorus]
And now, they're watching everything I do
And they're watching everything I say
So they'll leave me be
Oh, leave me be

[Outro]
And I only wanted to be sixteen
And free, yeah

And I wonder...

"
149,I'll Sleep When I'm Dead,Keep The Faith,Bon Jovi,1992-11-03,283133,47,"

[Verse 1]
Seven days of Saturday is all that I need
Got no use for Sunday because I don't rest in peace
Don't need no Mondays or the rest of the week
I spend a lot of time in bed but baby I don't like to sleep, no

[Pre-Chorus]
I won't lie to you
I'm never going to cry to you
I'll probably drive you wild eight days a week

[Chorus]
Until I'm six feet under, baby I don't need a bed
Gonna live while I'm alive, I'll sleep when I'm dead
Until they roll me over and lay my bones to rest
Gonna live while I'm alive, I'll sleep when I'm dead

[Verse 2]
So you're looking for some action, I got got everything you need
Better keep your motor running, because I was built for speed
This ain't no slumber party, got no time for catching z's
If they say that that ain't healthy, well then living's a disease

[Pre-Chorus]
We're never going to die baby
Come on let me drive you crazy
We'll make every night another New Year's Eve

[Chorus]
Until I'm six feet under, baby I don't need a bed
Gonna live while I'm alive, I'll sleep when I'm dead
Until they roll me over and lay my bones to rest
Gonns live while I'm alive, I'll sleep when I'm dead
Sleep when I'm dead, sleep when I'm dead
Gonna live while I'm alive, I'll sleep when I'm dead

[Guitar Solo]

[Bridge]
Seven days of Saturday is all that I need
Got no use for Sunday, because I don't rest in peace
I was born to live, you know I wasn't born to die
But if they party down in heaven, I'll be sure to be on time

[Chorus]
Until I'm six feet under, baby I don't need a bed
Gonna  live while I'm alive, I'll sleep when I'm dead
Until they roll me over and lay my bones to rest
Gonna  live while I'm alive, I'll sleep when I'm dead

[Outro]
I feel like I'm exploding, going out of my head
Gonna  live while I'm alive, I'll sleep when I'm dead
Until I'm six feet under and they lay my bones to rest
Gonna  live while I'm alive, I'll sleep when I'm dead
Sleep when I'm dead, sleep when I'm dead
Gonna live while I'm alive, sleep when I'm dead

"
150,High,Wish,The Cure,1992-01-01,212840,49,"

[Verse 1]
When I see you sky as a kite
As high as I might, I can't get that high
The how you move, the way you burst the clouds
It makes me want to try
And when I see you sticky as lips
As licky as trips, I can't lick that far
But when you pout, the way you shout out loud
It makes me want to start
And when I see you happy as a girl
That swims in a world of a magic show
It makes me bite my fingers through
To think I could've let you go

[Chorus]
And when I see you take the same sweet steps
You used to take, I say
""I'll keep on holding you in my arms so tight
I'll never let you slip away""

[Verse 2]
And when I see you kitten as a cat
Yeah, as smitten as that, I can't get that small
The way you fur, the how you purr
It makes me want to paw you all
And when I see you happy as a girl
That lives in a world of make believe
It makes me pull my hair all out
To think I could've let you leave

[Chorus]
And when I see you take the same sweet steps
You used to take, I know
I'll keep on holding you in my arms so tight
I'll never let you go

"
151,Find The River,Automatic For The People,R.E.M.,1992-10-05,229733,56,"

[Verse 1]
Hey now, little speedyhead
The read on the speed-meter says
You have to go to task in the city
Where people drown and people serve
Don't be shy, you're just dessert
Is only just light years to go

[Chorus 1]
Me, my thoughts are flower strewn
With ocean storm, bayberry moon
I have got to leave to find my way
Watch the road and memorize
This life that passed before my eyes
And nothing is going my way

[Verse 2]
The ocean is the river's goal
A need to leave the water knows
We're closer now than light years to go

[Chorus 2]
I have got to find the river
Bergamot and vetiver
Run through my head and fall away
Leave the road and memorize
This life that passed before my eyes
And nothing is going my way

[Verse 3]
There's no one left to take the lead
But I tell you and you can see
We're closer now than light years to go
Pick up here and chase the ride
The river empties to the tide
Fall into the ocean

[Chorus 3]
The river to the ocean goes
A fortune for the undertow
None of this is going my way
There is nothing left to throw
Of Ginger, lemon, indigo
Coriander stem and rose of hay

Strength and courage overrides
The privileged and weary eyes
Of river poet search naiveté
Pick up here and chase the ride
The river empties to the tide
All of this is coming your way

"
152,When I Look Into Your Eyes,Hold Your Fire,Firehouse,1992-03-31,239866,59,"

I see forever when I look in your eyes
You're all I ever wanted
I always want you to be mine
Let's make a promise till the end of time
We'll always be together
And our love will never die

So here we are face to face
And heart to heart
I want you to know we will
Never be apart
Now I believe that wishes can come true
'Cause I see my whole world
I see only you

When I look into your eyes
I can see how much I love you
And it makes me realize
When I look into your eyes
I see all my dreams come true
When I look into your eyes

I've looked for you all of my life
Now that I've found you
We will never say goodbye
I can't stop this feeling
And there's nothing I can do
'Cause I see everything when I look at you

When I look into your eyes
I can see how much I love you
And it makes me realize
When I look into your eyes
I see all my dreams come true
When I look into your eyes

When I look into your eyes
I can see how much I love you
And it makes me realize
When I look into your eyes
We will always be together
And our love will never die

When I look into your eyes
I see that only dreams come true
When I look into your eyes
When I look into your eyes

"
153,Until I Fall Away,New Miserable Experience,Gin Blossoms,1992-01-01,231760,30,"

[Verse 1]
I want to tell if I am or I am not myself
It's hard to know how far or if at all could go
Waiting far too long for something I forgot was wrong
I don't know all the answers I think that I'll find
Or have it within the time but it's all that I'll have in mind

[Chorus]
Until I fall away
That won't keep us waiting long
Until I fall away
I don't know what to do anymore
Until I fall away

[Verse 2]
My fear pretend that I'll never be in love again
It's real to me but not like these fools and not like this scene
I won't find or have it within the time
If it's all rusted and fade in the spot where we fell
Where I thought I'd left behind
It's loose now but we could try

[Chorus]
When there's no good answers
To those new questions
Another personal disaster
There's nowhere to go but down

"
154,29,New Miserable Experience,Gin Blossoms,1992-01-01,258000,34,"

Time won't stand by forever
If I know it's true
And I've learned not to say never
Else I'll seem the fool

29, you'd think I'd know better
Living like a kid
Cause when my lies may seem less than clever
It's when I fall for it

Only time will tell
If wishing wells
Can bring us anything
Fade like scenes
From childhood dreams
Forgotten memories

Some rides don't have much of a finish
That's the ride I took
Through good and bad and straight through indifferent
Without a second look

There's no intentions worthy of mention
If we never try
So hang your hopes on rusted out hinges
Take 'em for a ride

Only time will tell
If wishing wells
Will bring us anything
Fade like scenes
From childhood dreams
Forgotten memories

Some rides don't have much of a finish
That's the ride I took
Through good and bad and straight through indifferent
Without a second look

Only time will tell
If wishing wells
Will bring us anything
Fade like scenes
From childhood dreams
Forgotten memories

"
155,Paper Scratcher,Blind Melon,Blind Melon,1992-01-01,193666,33,"

[Verse 1]
Shuffle can to can, nobody really gives a damn
For every living day, I give myself a hand
Now, I'm scroungy as can be
I got all you normals looking at me
I'll scratch a hole in my life
So everyone can see

[Chorus]
My mind is a mind that I have come to know
And my eyes can't conceive a world that cannot grow

[Verse 2]
And Fridays are always fresh days
Screamin' at the sun
Don't really know what he has done
He don't believe in God and the world as one
So, he rambles through the weeds
Sayin' he will sleep beneath the trees

[Chorus]
My mind is a mind that I have come to know
And my eyes can't conceive a world that cannot grow

And on the day I die, thank God my soul will be released

[Solo]

[Chorus]
I've seen all your eyes
And I've seen all your faces
Can you tell me, honestly, do you want to be free?
Can you look in my eyes?
I've been lots of places
Can you tell me, honestly, that you'd want to be me?
Would you want to be me?
Honestly?

"
